{"run":63,"commit":"fdc8403","metric":31960.4,"metrics":{"decode_ChunkedText_ns":2046.74,"decode_DocumentLarge_ns":2927.43,"decode_DocumentSmall_ns":63.44,"decode_Embedding1536_ns":5.55,"decode_Embedding384_ns":5.32,"decode_Embedding768_ns":5.4,"decode_EmbeddingBatch_ns":21383.58,"decode_EmbeddingF32_768_ns":1.92,"decode_EventLarge_ns":14.37,"decode_EventSmall_ns":8.63,"decode_InferenceResponse_ns":68.07,"decode_JsonLarge_ns":1500.66,"decode_JsonSmall_ns":99.1,"decode_LLMChunkLarge_ns":1270.04,"decode_LLMChunkSmall_ns":80.25,"decode_OrderLarge_ns":211.28,"decode_OrderSmall_ns":16.85,"decode_PersonMedium_ns":11.84,"decode_PersonSmall_ns":10.85,"decode_TensorShardLarge_ns":21.54,"decode_TensorShardSmall_ns":25.51,"decode_TreeDeep_ns":1519.49,"decode_TreeWide_ns":662.52},"status":"discard","description":"ABLATION: Replace read_scalar_array unaligned bulk memcpy with safe per-element reads — catastrophic regression","timestamp":1774222963794,"segment":0,"confidence":19.515121467525958,"asi":{"hypothesis":"Ablation: replace unsafe copy_nonoverlapping + set_len in read_scalar_array unaligned path with safe per-element T::read_from loop","rollback_reason":"Catastrophic +190% total regression. EmbeddingBatch 495→21,384 (+4200%), OrderLarge 44→211 (+380%). Per-element reads with bounds checks destroy performance for large scalar arrays.","finding":"read_scalar_array unaligned bulk memcpy is CONFIRMED ESSENTIAL — cannot be removed","confirmed_essential":true}}
{"run":64,"commit":"f30f054","metric":10957.94,"metrics":{"decode_ChunkedText_ns":2036.99,"decode_DocumentLarge_ns":2900.63,"decode_DocumentSmall_ns":59.39,"decode_Embedding1536_ns":1.83,"decode_Embedding384_ns":1.73,"decode_Embedding768_ns":1.66,"decode_EmbeddingBatch_ns":514.62,"decode_EmbeddingF32_768_ns":1.79,"decode_EventLarge_ns":15.91,"decode_EventSmall_ns":8.66,"decode_InferenceResponse_ns":50.73,"decode_JsonLarge_ns":1579.29,"decode_JsonSmall_ns":91.22,"decode_LLMChunkLarge_ns":1322.42,"decode_LLMChunkSmall_ns":81.78,"decode_OrderLarge_ns":43.92,"decode_OrderSmall_ns":17.31,"decode_PersonMedium_ns":13.18,"decode_PersonSmall_ns":11.24,"decode_TensorShardLarge_ns":23.25,"decode_TensorShardSmall_ns":27.38,"decode_TreeDeep_ns":1465.65,"decode_TreeWide_ns":687.33},"status":"keep","description":"ABLATION: Remove unsafe from write_scalar_array — safe per-element writes, zero decode impact","timestamp":1774223046726,"segment":0,"confidence":18.614358479226734,"asi":{"hypothesis":"Ablation: replace unsafe from_raw_parts in write_scalar_array with safe per-element writes","finding":"Writer unsafe has zero impact on decode performance (encode-only path). Safe to remove for code quality. May affect encode performance but that's not measured here.","encode_caveat":"Encode of large scalar arrays (EmbeddingBatch etc) may be slower — not measured by decode benchmark"}}
