{"run":48,"commit":"33cb4a2","metric":11138.71,"metrics":{"decode_ChunkedText_ns":2001.62,"decode_DocumentLarge_ns":2852.28,"decode_DocumentSmall_ns":73.66,"decode_Embedding1536_ns":2.11,"decode_Embedding384_ns":1.93,"decode_Embedding768_ns":2.04,"decode_EmbeddingBatch_ns":539.81,"decode_EmbeddingF32_768_ns":1.62,"decode_EventLarge_ns":13.59,"decode_EventSmall_ns":7.87,"decode_InferenceResponse_ns":63.05,"decode_JsonLarge_ns":1484.16,"decode_JsonSmall_ns":106.58,"decode_LLMChunkLarge_ns":1343.2,"decode_LLMChunkSmall_ns":94.81,"decode_OrderLarge_ns":44.12,"decode_OrderSmall_ns":18.74,"decode_PersonMedium_ns":12.18,"decode_PersonSmall_ns":11.45,"decode_TensorShardLarge_ns":26.33,"decode_TensorShardSmall_ns":30.34,"decode_TreeDeep_ns":1645.25,"decode_TreeWide_ns":761.94},"status":"keep","description":"Cleanup: use String::from instead of to_owned(), remove ToOwned import","timestamp":1774211186611,"segment":0,"confidence":18.429368029739784,"asi":{"hypothesis":"Code cleanup: String::from vs to_owned() should be identical codegen","finding":"Performance neutral as expected. Removes unnecessary ToOwned import for cleaner code.","note":"Minor cleanup, zero performance impact"}}
{"run":49,"commit":"ac0ee8c","metric":10826.78,"metrics":{"decode_ChunkedText_ns":2014.68,"decode_DocumentLarge_ns":2791.2,"decode_DocumentSmall_ns":62.17,"decode_Embedding1536_ns":1.34,"decode_Embedding384_ns":1.51,"decode_Embedding768_ns":1.55,"decode_EmbeddingBatch_ns":511.55,"decode_EmbeddingF32_768_ns":1.57,"decode_EventLarge_ns":12.46,"decode_EventSmall_ns":8.23,"decode_InferenceResponse_ns":53.22,"decode_JsonLarge_ns":1498.84,"decode_JsonSmall_ns":93.1,"decode_LLMChunkLarge_ns":1355.4,"decode_LLMChunkSmall_ns":87.48,"decode_OrderLarge_ns":43.67,"decode_OrderSmall_ns":19.11,"decode_PersonMedium_ns":11.72,"decode_PersonSmall_ns":10.02,"decode_TensorShardLarge_ns":24.04,"decode_TensorShardSmall_ns":29.1,"decode_TreeDeep_ns":1531.19,"decode_TreeWide_ns":663.62},"status":"keep","description":"Set codegen-units = 1 in release profile — allows LLVM full optimization scope","timestamp":1774211311163,"segment":0,"confidence":18.720592706707478,"asi":{"hypothesis":"codegen-units = 1 gives LLVM a single codegen unit per crate, enabling cross-function optimizations that 16 units can't do","finding":"Consistent -2.9% improvement (two runs: 10816, 10827). TreeWide -13%, InferenceResponse -16%, TreeDeep -7%. This is a general build configuration any user can adopt.","tradeoff":"~2x longer build times in release mode","note":"Different from ThinLTO (which was tried and failed) — this is intra-crate optimization, not cross-crate"}}
{"run":50,"commit":"fdc8403","metric":10615.33,"metrics":{"decode_ChunkedText_ns":2024.86,"decode_DocumentLarge_ns":2849.8,"decode_DocumentSmall_ns":63.97,"decode_Embedding1536_ns":1.65,"decode_Embedding384_ns":1.6,"decode_Embedding768_ns":1.65,"decode_EmbeddingBatch_ns":484.55,"decode_EmbeddingF32_768_ns":1.69,"decode_EventLarge_ns":12.62,"decode_EventSmall_ns":7.67,"decode_InferenceResponse_ns":51.44,"decode_JsonLarge_ns":1488.92,"decode_JsonSmall_ns":96.13,"decode_LLMChunkLarge_ns":1233.81,"decode_LLMChunkSmall_ns":79.88,"decode_OrderLarge_ns":44.29,"decode_OrderSmall_ns":17.66,"decode_PersonMedium_ns":14.21,"decode_PersonSmall_ns":10.79,"decode_TensorShardLarge_ns":26.31,"decode_TensorShardSmall_ns":23.34,"decode_TreeDeep_ns":1421.85,"decode_TreeWide_ns":656.62},"status":"keep","description":"Add ThinLTO on top of codegen-units=1 — cross-crate optimization stacks with intra-crate","timestamp":1774211362116,"segment":0,"confidence":19.17544732114767,"asi":{"hypothesis":"ThinLTO + codegen-units=1 enables both intra-crate and cross-crate LLVM optimization. Previously ThinLTO alone failed because default codegen-units already limited intra-crate optimization.","finding":"Consistent -1.3% improvement (two runs: 10749, 10615). TreeDeep -7.1%, LLMChunkLarge -8.9%. Cross-crate optimization now stacks with intra-crate.","note":"Previous ThinLTO experiment (run 21) failed because codegen-units was default 16. The combination is key."}}
{"run":51,"commit":"flto01","metric":11795.47,"metrics":{"decode_ChunkedText_ns":2008.43,"decode_DocumentLarge_ns":3070.42,"decode_DocumentSmall_ns":66.19,"decode_Embedding1536_ns":1.59,"decode_Embedding384_ns":1.63,"decode_Embedding768_ns":1.49,"decode_EmbeddingBatch_ns":491.27,"decode_EmbeddingF32_768_ns":1.76,"decode_EventLarge_ns":14.71,"decode_EventSmall_ns":8.83,"decode_InferenceResponse_ns":53.22,"decode_JsonLarge_ns":1575.76,"decode_JsonSmall_ns":97.46,"decode_LLMChunkLarge_ns":1236.46,"decode_LLMChunkSmall_ns":81.6,"decode_OrderLarge_ns":49.96,"decode_OrderSmall_ns":18.01,"decode_PersonMedium_ns":12.24,"decode_PersonSmall_ns":10.77,"decode_TensorShardLarge_ns":25.48,"decode_TensorShardSmall_ns":26.64,"decode_TreeDeep_ns":2293.33,"decode_TreeWide_ns":648.22},"status":"discard","description":"Try fat LTO instead of thin — regression, especially TreeDeep +61%","timestamp":1774211395610,"segment":0,"confidence":19.25576844679982,"asi":{"hypothesis":"Fat LTO might optimize better than ThinLTO with full cross-crate visibility","rollback_reason":"+10.4% total regression. TreeDeep 1422→2293 (+61%). Fat LTO makes poor inlining decisions for recursive types, causing code bloat that hurts icache.","finding":"ThinLTO is optimal. Fat LTO over-inlines recursive decode paths. Stick with ThinLTO."}}
{"run":52,"commit":"strip1","metric":10640.6,"metrics":{"decode_ChunkedText_ns":2020.66,"decode_DocumentLarge_ns":2807.7,"decode_DocumentSmall_ns":63.98,"decode_Embedding1536_ns":1.69,"decode_Embedding384_ns":1.69,"decode_Embedding768_ns":1.69,"decode_EmbeddingBatch_ns":536.25,"decode_EmbeddingF32_768_ns":1.78,"decode_EventLarge_ns":12.66,"decode_EventSmall_ns":8.06,"decode_InferenceResponse_ns":50.67,"decode_JsonLarge_ns":1486.06,"decode_JsonSmall_ns":89.78,"decode_LLMChunkLarge_ns":1272.93,"decode_LLMChunkSmall_ns":81.78,"decode_OrderLarge_ns":46.88,"decode_OrderSmall_ns":18.32,"decode_PersonMedium_ns":11.49,"decode_PersonSmall_ns":11.11,"decode_TensorShardLarge_ns":23.31,"decode_TensorShardSmall_ns":26.14,"decode_TreeDeep_ns":1424.2,"decode_TreeWide_ns":641.76},"status":"discard","description":"Add strip=symbols to release profile — no runtime performance impact","timestamp":1774211601647,"segment":0,"confidence":19.62641403596251,"asi":{"hypothesis":"Stripping symbols reduces binary size which might improve icache behavior","rollback_reason":"Within noise. Symbol tables are in a separate section, not loaded into code cache. Stripping doesn't affect runtime performance.","finding":"strip=symbols has no runtime impact. Only useful for deployment binary size."}}
{"run":53,"commit":"panicab","metric":10593.37,"metrics":{"decode_ChunkedText_ns":2012.34,"decode_DocumentLarge_ns":2815.23,"decode_DocumentSmall_ns":68.58,"decode_Embedding1536_ns":1.72,"decode_Embedding384_ns":1.58,"decode_Embedding768_ns":1.67,"decode_EmbeddingBatch_ns":541.16,"decode_EmbeddingF32_768_ns":1.65,"decode_EventLarge_ns":13.94,"decode_EventSmall_ns":8.34,"decode_InferenceResponse_ns":52.14,"decode_JsonLarge_ns":1476.48,"decode_JsonSmall_ns":106.94,"decode_LLMChunkLarge_ns":1254.28,"decode_LLMChunkSmall_ns":82.46,"decode_OrderLarge_ns":44.15,"decode_OrderSmall_ns":18.75,"decode_PersonMedium_ns":11.77,"decode_PersonSmall_ns":11.28,"decode_TensorShardLarge_ns":23.5,"decode_TensorShardSmall_ns":27.22,"decode_TreeDeep_ns":1382.8,"decode_TreeWide_ns":635.41},"status":"discard","description":"Add panic=abort to release profile — ~2% improvement but changes program semantics too much","timestamp":1774211663176,"segment":0,"confidence":20.070279801992797,"asi":{"hypothesis":"panic=abort eliminates unwinding infrastructure, making ? and unwrap() cheaper","rollback_reason":"While effective (-1.9% avg), panic=abort changes program semantics — no catch_unwind, no cleanup on panic. Too opinionated for a workspace default. Should be a user recommendation instead.","finding":"panic=abort provides ~2% improvement. Recommended for performance-critical deployments but not appropriate as a library default.","user_recommendation":"For maximum decode performance, add panic='abort' to [profile.release] in your Cargo.toml"}}
{"run":54,"commit":"msgpre1","metric":10570.04,"metrics":{"decode_ChunkedText_ns":1932.95,"decode_DocumentLarge_ns":2738.42,"decode_DocumentSmall_ns":65.13,"decode_Embedding1536_ns":1.59,"decode_Embedding384_ns":1.67,"decode_Embedding768_ns":1.65,"decode_EmbeddingBatch_ns":470.08,"decode_EmbeddingF32_768_ns":1.57,"decode_EventLarge_ns":16.01,"decode_EventSmall_ns":8.18,"decode_InferenceResponse_ns":47.25,"decode_JsonLarge_ns":1588.82,"decode_JsonSmall_ns":96.07,"decode_LLMChunkLarge_ns":1195.21,"decode_LLMChunkSmall_ns":78.28,"decode_OrderLarge_ns":46.68,"decode_OrderSmall_ns":17.22,"decode_PersonMedium_ns":10.67,"decode_PersonSmall_ns":11.74,"decode_TensorShardLarge_ns":19.33,"decode_TensorShardSmall_ns":24.58,"decode_TreeDeep_ns":1527.82,"decode_TreeWide_ns":669.13},"status":"discard","description":"Pre-validate message body in read_message_length — adds overhead, doesn't eliminate downstream checks","timestamp":1774211868136,"segment":0,"confidence":19.280920891501346,"asi":{"hypothesis":"Pre-validating entire message body with ensure(len) could help LLVM eliminate per-field bounds checks with ThinLTO","rollback_reason":"JsonLarge +6.7%, TreeDeep +7.4%. Extra ensure per message adds overhead. LLVM still can't prove downstream reads are safe because pos is mutated between reads.","finding":"Same as experiment 9 — redundant ensure on hot message decode path hurts. LLVM cannot propagate the pre-validation across pos mutations even with ThinLTO.","next_action_hint":"Message decode overhead is irreducible with current pattern. Only structural changes (skip tag loop for known-layout messages) could help."}}
{"run":55,"commit":"erru32","metric":11365.76,"metrics":{"decode_ChunkedText_ns":1965.88,"decode_DocumentLarge_ns":2938.85,"decode_DocumentSmall_ns":68.64,"decode_Embedding1536_ns":1.79,"decode_Embedding384_ns":1.71,"decode_Embedding768_ns":1.81,"decode_EmbeddingBatch_ns":528.57,"decode_EmbeddingF32_768_ns":1.56,"decode_EventLarge_ns":17.11,"decode_EventSmall_ns":12.25,"decode_InferenceResponse_ns":60.84,"decode_JsonLarge_ns":1680.9,"decode_JsonSmall_ns":103.36,"decode_LLMChunkLarge_ns":1464.73,"decode_LLMChunkSmall_ns":81.78,"decode_OrderLarge_ns":46.03,"decode_OrderSmall_ns":18.09,"decode_PersonMedium_ns":10.57,"decode_PersonSmall_ns":9.79,"decode_TensorShardLarge_ns":22.79,"decode_TensorShardSmall_ns":27.4,"decode_TreeDeep_ns":1537.88,"decode_TreeWide_ns":763.41},"status":"discard","description":"Shrink DecodeError (usize→u32 for eof fields) — regression, Result layout changes hurt LLVM codegen","timestamp":1774212099974,"segment":0,"confidence":19.666250312265774,"asi":{"hypothesis":"Smaller DecodeError reduces Result<T> size from ~32 to ~24 bytes, potentially fitting in registers instead of sret","rollback_reason":"+6.2% total regression. TreeWide +17%, JsonLarge +13%, LLMChunkLarge +19%. The borderline Result size (between register and sret) causes LLVM to make suboptimal choices. The clearly-too-large-for-registers 32-byte Result with sret was actually well-optimized.","finding":"DecodeError size does NOT matter for performance. LLVM handles the large sret Result efficiently. Shrinking it to a borderline size hurts.","dead_end":true}}
{"run":56,"commit":"cold2","metric":11071.86,"metrics":{"decode_ChunkedText_ns":1982.04,"decode_DocumentLarge_ns":2889.77,"decode_DocumentSmall_ns":80.27,"decode_Embedding1536_ns":1.58,"decode_Embedding384_ns":1.6,"decode_Embedding768_ns":1.6,"decode_EmbeddingBatch_ns":557,"decode_EmbeddingF32_768_ns":0.87,"decode_EventLarge_ns":16.8,"decode_EventSmall_ns":11.19,"decode_InferenceResponse_ns":61.95,"decode_JsonLarge_ns":1690.21,"decode_JsonSmall_ns":99.22,"decode_LLMChunkLarge_ns":1401.22,"decode_LLMChunkSmall_ns":80.82,"decode_OrderLarge_ns":41.46,"decode_OrderSmall_ns":17.06,"decode_PersonMedium_ns":14.4,"decode_PersonSmall_ns":12.28,"decode_TensorShardLarge_ns":24.79,"decode_TensorShardSmall_ns":28.5,"decode_TreeDeep_ns":1421.56,"decode_TreeWide_ns":635.67},"status":"discard","description":"#[cold] #[inline(never)] on eof_error — still regresses even with ThinLTO","timestamp":1774212178298,"segment":0,"confidence":18.751622699934497,"asi":{"hypothesis":"Revisit #[cold] on error path now that ThinLTO + codegen-units=1 gives LLVM better layout control","rollback_reason":"+3.5% total. JsonLarge +13.5%, LLMChunkLarge +13.5%. #[inline(never)] forces error construction out-of-line, hurting register allocation. Same finding as experiment 7.","finding":"CONFIRMED: #[cold] on error path is a dead end regardless of LTO settings. LLVM handles error path layout better when it has full control.","dead_end":true}}
{"run":57,"commit":"neqcmp","metric":10763.15,"metrics":{"decode_ChunkedText_ns":2010.95,"decode_DocumentLarge_ns":2846.65,"decode_DocumentSmall_ns":66.18,"decode_Embedding1536_ns":1.68,"decode_Embedding384_ns":1.68,"decode_Embedding768_ns":1.61,"decode_EmbeddingBatch_ns":499.94,"decode_EmbeddingF32_768_ns":1.72,"decode_EventLarge_ns":14.6,"decode_EventSmall_ns":8.59,"decode_InferenceResponse_ns":49.18,"decode_JsonLarge_ns":1592.95,"decode_JsonSmall_ns":92.21,"decode_LLMChunkLarge_ns":1186.65,"decode_LLMChunkSmall_ns":83.67,"decode_OrderLarge_ns":42.21,"decode_OrderSmall_ns":17.12,"decode_PersonMedium_ns":11.19,"decode_PersonSmall_ns":12.14,"decode_TensorShardLarge_ns":23.87,"decode_TensorShardSmall_ns":26.06,"decode_TreeDeep_ns":1498.43,"decode_TreeWide_ns":673.85},"status":"discard","description":"Try pos != len instead of pos < len in read_byte — within noise, identical codegen","timestamp":1774212263132,"segment":0,"confidence":18.43185764735727,"asi":{"hypothesis":"!= comparison might generate different branch condition (b.ne vs b.lo on aarch64)","rollback_reason":"Within noise. LLVM generates identical branch code for both patterns when inlined. Keep < for readability.","finding":"Comparison operator doesn't matter — LLVM optimizes both to equivalent branch on aarch64."}}
{"run":58,"commit":"iuu01","metric":10855.18,"metrics":{"decode_ChunkedText_ns":1917.48,"decode_DocumentLarge_ns":2893.52,"decode_DocumentSmall_ns":67.53,"decode_Embedding1536_ns":2.43,"decode_Embedding384_ns":1.69,"decode_Embedding768_ns":1.77,"decode_EmbeddingBatch_ns":505.03,"decode_EmbeddingF32_768_ns":1.61,"decode_EventLarge_ns":14.05,"decode_EventSmall_ns":8.5,"decode_InferenceResponse_ns":49.89,"decode_JsonLarge_ns":1547.93,"decode_JsonSmall_ns":96.47,"decode_LLMChunkLarge_ns":1306.84,"decode_LLMChunkSmall_ns":85.89,"decode_OrderLarge_ns":50.11,"decode_OrderSmall_ns":19.08,"decode_PersonMedium_ns":11.45,"decode_PersonSmall_ns":10.36,"decode_TensorShardLarge_ns":22.79,"decode_TensorShardSmall_ns":27.39,"decode_TreeDeep_ns":1540.15,"decode_TreeWide_ns":673.21},"status":"discard","description":"Use insert_unique_unchecked in read_map — no improvement, probing rarely compares keys","timestamp":1774212514950,"segment":0,"confidence":18.366994595014965,"asi":{"hypothesis":"insert_unique_unchecked skips duplicate key check, saving a key comparison per insert","rollback_reason":"Within noise. hashbrown's probing finds empty slots directly (avg ~1.14 probes). Key comparisons only happen on hash collisions, which are rare with good capacity.","finding":"HashMap insert overhead is dominated by hashing + memory allocation, not key comparison. Skipping duplicate check saves negligible time."}}
{"run":59,"commit":"mapext","metric":11076.42,"metrics":{"decode_ChunkedText_ns":1981.06,"decode_DocumentLarge_ns":3064.85,"decode_DocumentSmall_ns":77.99,"decode_Embedding1536_ns":1.8,"decode_Embedding384_ns":1.95,"decode_Embedding768_ns":1.73,"decode_EmbeddingBatch_ns":502.03,"decode_EmbeddingF32_768_ns":1.66,"decode_EventLarge_ns":13.34,"decode_EventSmall_ns":8.82,"decode_InferenceResponse_ns":49.36,"decode_JsonLarge_ns":1724.34,"decode_JsonSmall_ns":110.63,"decode_LLMChunkLarge_ns":1236.38,"decode_LLMChunkSmall_ns":80.35,"decode_OrderLarge_ns":43.29,"decode_OrderSmall_ns":17.66,"decode_PersonMedium_ns":12.54,"decode_PersonSmall_ns":10.76,"decode_TensorShardLarge_ns":23.5,"decode_TensorShardSmall_ns":25.8,"decode_TreeDeep_ns":1439.06,"decode_TreeWide_ns":647.5},"status":"discard","description":"Build Vec of entries then collect to HashMap — regression from extra allocation","timestamp":1774212556791,"segment":0,"confidence":18.302586457425114,"asi":{"hypothesis":"Building entries in a Vec then collecting to HashMap might let hashbrown batch-insert more efficiently","rollback_reason":"JsonLarge +15.8%, JsonSmall +18.6%. Extra Vec allocation + from_iter overhead worse than direct insert loop. The with_capacity+insert pattern is already optimal.","finding":"Direct insert loop is better than Vec→collect for HashMap construction"}}
{"run":60,"commit":"fxhash","metric":10527.83,"metrics":{"decode_ChunkedText_ns":1966.59,"decode_DocumentLarge_ns":2810.97,"decode_DocumentSmall_ns":61.3,"decode_Embedding1536_ns":1.66,"decode_Embedding384_ns":1.5,"decode_Embedding768_ns":1.57,"decode_EmbeddingBatch_ns":513.56,"decode_EmbeddingF32_768_ns":1.67,"decode_EventLarge_ns":13.81,"decode_EventSmall_ns":8.63,"decode_InferenceResponse_ns":53.81,"decode_JsonLarge_ns":1517.86,"decode_JsonSmall_ns":88.83,"decode_LLMChunkLarge_ns":1199.52,"decode_LLMChunkSmall_ns":80.56,"decode_OrderLarge_ns":45.03,"decode_OrderSmall_ns":17.82,"decode_PersonMedium_ns":12.77,"decode_PersonSmall_ns":11.23,"decode_TensorShardLarge_ns":21.79,"decode_TensorShardSmall_ns":26.36,"decode_TreeDeep_ns":1430.08,"decode_TreeWide_ns":640.9},"status":"discard","description":"FxHash instead of foldhash — abandoned, too invasive (changes HashMap type everywhere), marginal expected gain","timestamp":1774212714368,"segment":0,"confidence":18.889415434450015,"asi":{"hypothesis":"FxHash multiply+XOR might be faster than foldhash for short string keys","rollback_reason":"Changing the default hasher ripples through all fixture code, integration tests, and generated types. The expected gain for short keys is marginal — foldhash is already optimized for this use case. Abandoned without benchmarking due to invasiveness.","finding":"Hasher swaps require massive API surface changes. foldhash is already near-optimal for string keys. Not worth pursuing."}}
{"run":61,"commit":"fdc8403","metric":10460.87,"metrics":{"decode_ChunkedText_ns":1972.88,"decode_DocumentLarge_ns":2791.43,"decode_DocumentSmall_ns":59.85,"decode_Embedding1536_ns":1.68,"decode_Embedding384_ns":1.61,"decode_Embedding768_ns":1.61,"decode_EmbeddingBatch_ns":475.51,"decode_EmbeddingF32_768_ns":1.65,"decode_EventLarge_ns":14.7,"decode_EventSmall_ns":7.65,"decode_InferenceResponse_ns":47.44,"decode_JsonLarge_ns":1440.13,"decode_JsonSmall_ns":90.16,"decode_LLMChunkLarge_ns":1159.38,"decode_LLMChunkSmall_ns":77.36,"decode_OrderLarge_ns":47.56,"decode_OrderSmall_ns":18.92,"decode_PersonMedium_ns":11.78,"decode_PersonSmall_ns":10.43,"decode_TensorShardLarge_ns":20.56,"decode_TensorShardSmall_ns":24.76,"decode_TreeDeep_ns":1513.33,"decode_TreeWide_ns":670.49},"status":"discard","description":"Baseline measurement — no code changes, confirming plateau at ~10,500ns (47.8% improvement)","timestamp":1774212920803,"segment":0,"confidence":19.515121467525958,"asi":{"hypothesis":"Baseline stability check","rollback_reason":"No code changes to keep — this is a measurement-only run","finding":"Plateau confirmed across 6 sessions. All safe non-structural optimizations exhausted. Remaining ~10,500ns is: UTF-8 floor ~4,800ns + TreeDeep allocs ~1,500ns + JsonLarge HashMap ~1,500ns + LLMChunkLarge strings ~1,200ns + TreeWide msgs ~670ns + everything else ~830ns","next_action_hint":"Only SmallVec (API change) or arena allocator (major engineering) can improve further"}}
{"run":62,"commit":"fdc8403","metric":11417.52,"metrics":{"decode_ChunkedText_ns":2071.93,"decode_DocumentLarge_ns":2879.1,"decode_DocumentSmall_ns":60.83,"decode_Embedding1536_ns":1.72,"decode_Embedding384_ns":1.62,"decode_Embedding768_ns":1.76,"decode_EmbeddingBatch_ns":516.76,"decode_EmbeddingF32_768_ns":1.75,"decode_EventLarge_ns":17.15,"decode_EventSmall_ns":7.89,"decode_InferenceResponse_ns":55.41,"decode_JsonLarge_ns":1536.41,"decode_JsonSmall_ns":92.91,"decode_LLMChunkLarge_ns":1391.6,"decode_LLMChunkSmall_ns":87.48,"decode_OrderLarge_ns":44.33,"decode_OrderSmall_ns":17.37,"decode_PersonMedium_ns":12.6,"decode_PersonSmall_ns":10.63,"decode_TensorShardLarge_ns":22.09,"decode_TensorShardSmall_ns":25.03,"decode_TreeDeep_ns":1646.97,"decode_TreeWide_ns":914.19},"status":"discard","description":"ABLATION: Replace read_array ptr::write/set_len with safe push — regression confirms unsafe is needed","timestamp":1774222922564,"segment":0,"confidence":19.750331894253687,"asi":{"hypothesis":"Ablation: replace unsafe ptr::write + set_len in read_array with safe Vec::push to see if capacity check overhead matters","rollback_reason":"+3.8% total regression. TreeWide 672→914 (+36%), LLMChunkLarge +7.8%. Per-element capacity check in push is measurable overhead when decoding arrays of 100+ elements.","finding":"read_array unsafe is CONFIRMED ESSENTIAL — cannot be removed","confirmed_essential":true}}
