{"run":18,"commit":"encinl1","metric":12143.57,"metrics":{"decode_ChunkedText_ns":2033.45,"decode_DocumentLarge_ns":3094.48,"decode_DocumentSmall_ns":80.98,"decode_Embedding1536_ns":2.18,"decode_Embedding384_ns":2.23,"decode_Embedding768_ns":2.25,"decode_EmbeddingBatch_ns":550.68,"decode_EmbeddingF32_768_ns":1.62,"decode_EventLarge_ns":13.19,"decode_EventSmall_ns":6.56,"decode_InferenceResponse_ns":71.73,"decode_JsonLarge_ns":2015.57,"decode_JsonSmall_ns":114.14,"decode_LLMChunkLarge_ns":1263.99,"decode_LLMChunkSmall_ns":86.54,"decode_OrderLarge_ns":47.17,"decode_OrderSmall_ns":18.5,"decode_PersonMedium_ns":10.72,"decode_PersonSmall_ns":9.93,"decode_TensorShardLarge_ns":27.9,"decode_TensorShardSmall_ns":28.75,"decode_TreeDeep_ns":1761.76,"decode_TreeWide_ns":899.25},"status":"discard","description":"Add #[inline] to generated encode/encoded_size methods","timestamp":1774206840937,"segment":0,"confidence":3.6022520648503478,"asi":{"hypothesis":"Encode/encoded_size inline annotations might improve icache locality by making encode code smaller and putting decode code in a better position","rollback_reason":"No improvement — encode code layout doesn't affect decode performance","next_action_hint":"We've exhausted easy optimizations. Current best is 42.5% improvement. Remaining gains require HashMap type changes or batch struct decode with enum support."}}
{"run":19,"commit":"simdfn1","metric":11746.79,"metrics":{"decode_ChunkedText_ns":2021.27,"decode_DocumentLarge_ns":3084.4,"decode_DocumentSmall_ns":77.3,"decode_Embedding1536_ns":2.4,"decode_Embedding384_ns":2.38,"decode_Embedding768_ns":2.55,"decode_EmbeddingBatch_ns":584.27,"decode_EmbeddingF32_768_ns":1.62,"decode_EventLarge_ns":11.75,"decode_EventSmall_ns":6.46,"decode_InferenceResponse_ns":57.17,"decode_JsonLarge_ns":1864.86,"decode_JsonSmall_ns":114.13,"decode_LLMChunkLarge_ns":1235.2,"decode_LLMChunkSmall_ns":87.89,"decode_OrderLarge_ns":48.62,"decode_OrderSmall_ns":17.36,"decode_PersonMedium_ns":12.11,"decode_PersonSmall_ns":10.84,"decode_TensorShardLarge_ns":21.63,"decode_TensorShardSmall_ns":28.47,"decode_TreeDeep_ns":1597.03,"decode_TreeWide_ns":857.06},"status":"discard","description":"Use simdutf8::basic::from_utf8 directly as simd_from_utf8 returning &str (avoid separate validate + unsafe unchecked)","timestamp":1774207028650,"segment":0,"confidence":2.3852127998747084,"asi":{"hypothesis":"Using simdutf8::basic::from_utf8 directly avoids double-wrapping (validate bool + unsafe unchecked)","rollback_reason":"No improvement — compiler already optimized the previous pattern equivalently","next_action_hint":"Try batch fixed-size struct decode with enum support, or try optimizing EmbeddingBatch by reducing per-element overhead in read_scalar_array"}}
{"run":20,"commit":"batch01","metric":11680.81,"metrics":{"decode_ChunkedText_ns":1998.35,"decode_DocumentLarge_ns":2955.87,"decode_DocumentSmall_ns":76.26,"decode_Embedding1536_ns":2.28,"decode_Embedding384_ns":2.36,"decode_Embedding768_ns":2.28,"decode_EmbeddingBatch_ns":546.53,"decode_EmbeddingF32_768_ns":1.61,"decode_EventLarge_ns":12.75,"decode_EventSmall_ns":6.42,"decode_InferenceResponse_ns":60.65,"decode_JsonLarge_ns":1899.63,"decode_JsonSmall_ns":121.11,"decode_LLMChunkLarge_ns":1250.32,"decode_LLMChunkSmall_ns":87.54,"decode_OrderLarge_ns":43.49,"decode_OrderSmall_ns":17.19,"decode_PersonMedium_ns":11.15,"decode_PersonSmall_ns":10.07,"decode_TensorShardLarge_ns":24.67,"decode_TensorShardSmall_ns":26.56,"decode_TreeDeep_ns":1628.78,"decode_TreeWide_ns":894.95},"status":"discard","description":"Batch struct decode: single ensure_available + unchecked reads for fixed-size structs (TextSpan: u32+u32+enum_u8=9 bytes)","timestamp":1774207257516,"segment":0,"confidence":3.2421405165400774,"asi":{"hypothesis":"Batch bounds check (1 ensure instead of 3 per TextSpan) should save 2 checks × 137 spans = 274 bounds checks in ChunkedText","rollback_reason":"Within noise. TextSpan decode is only ~500ns of ChunkedText's 2000ns total. Saving 2 bounds checks per span saves ~1ns each = ~137ns, lost in noise. The compiler may already merge consecutive bounds checks for inlined reads.","next_action_hint":"Try targeting the larger contributors: EmbeddingBatch (549ns, 8 array elements with overhead), or see if InferenceTiming can use batch reads (duration+duration+f32 = 28 bytes)"}}
{"run":21,"commit":"lto01","metric":11902.63,"metrics":{"decode_ChunkedText_ns":2076.2,"decode_DocumentLarge_ns":3226.55,"decode_DocumentSmall_ns":75.17,"decode_Embedding1536_ns":2.36,"decode_Embedding384_ns":2.38,"decode_Embedding768_ns":2.33,"decode_EmbeddingBatch_ns":565.35,"decode_EmbeddingF32_768_ns":1.58,"decode_EventLarge_ns":12.47,"decode_EventSmall_ns":7.39,"decode_InferenceResponse_ns":59.57,"decode_JsonLarge_ns":1832.82,"decode_JsonSmall_ns":118.57,"decode_LLMChunkLarge_ns":1193.08,"decode_LLMChunkSmall_ns":86.53,"decode_OrderLarge_ns":45.08,"decode_OrderSmall_ns":17.64,"decode_PersonMedium_ns":11.68,"decode_PersonSmall_ns":9.84,"decode_TensorShardLarge_ns":29.1,"decode_TensorShardSmall_ns":26.77,"decode_TreeDeep_ns":1609.74,"decode_TreeWide_ns":890.41},"status":"discard","description":"Enable thin LTO in release profile for cross-crate optimization","timestamp":1774207403611,"segment":0,"confidence":13.979887553887265,"asi":{"hypothesis":"ThinLTO enables cross-crate optimization that #[inline] alone might miss","rollback_reason":"No improvement — our #[inline(always)] annotations already handle cross-crate inlining. LTO adds 4x build time with no decode benefit.","next_action_hint":"The easy optimizations are exhausted. Remaining bottlenecks: HashMap SipHash (JsonLarge), recursive Vec allocs (TreeDeep), simdutf8 ceiling (DocLarge/ChunkedText). Need structural changes or API breaks to go further."}}
{"run":22,"commit":"cowstr1","metric":12470.48,"metrics":{"decode_ChunkedText_ns":2281.93,"decode_DocumentLarge_ns":3209.73,"decode_DocumentSmall_ns":73.96,"decode_Embedding1536_ns":2.41,"decode_Embedding384_ns":2.43,"decode_Embedding768_ns":2.46,"decode_EmbeddingBatch_ns":600.11,"decode_EmbeddingF32_768_ns":1.65,"decode_EventLarge_ns":12.22,"decode_EventSmall_ns":6.66,"decode_InferenceResponse_ns":60.17,"decode_JsonLarge_ns":1934.76,"decode_JsonSmall_ns":115.4,"decode_LLMChunkLarge_ns":1322.89,"decode_LLMChunkSmall_ns":90.84,"decode_OrderLarge_ns":43.57,"decode_OrderSmall_ns":18.89,"decode_PersonMedium_ns":11.12,"decode_PersonSmall_ns":10.73,"decode_TensorShardLarge_ns":24.54,"decode_TensorShardSmall_ns":25.99,"decode_TreeDeep_ns":1716.4,"decode_TreeWide_ns":901.62},"status":"discard","description":"Add read_cow_str convenience method and use in generated code for string arrays/map keys","timestamp":1774207549522,"segment":0,"confidence":12.186134567848315,"asi":{"hypothesis":"read_cow_str() convenience method simplifies generated code and may help compiler","rollback_reason":"Regression — extra function layer hurt. Compiler already optimized the inline Ok(Cow::Borrowed(read_str()?)) pattern well.","next_action_hint":"We're solidly in diminishing returns. Consider focusing on LLMChunkLarge string reads or accepting current 42.5% improvement."}}
{"run":23,"commit":"strinl1","metric":11758.8,"metrics":{"decode_ChunkedText_ns":2041.19,"decode_DocumentLarge_ns":3035.18,"decode_DocumentSmall_ns":74.32,"decode_Embedding1536_ns":2.47,"decode_Embedding384_ns":2.37,"decode_Embedding768_ns":2.4,"decode_EmbeddingBatch_ns":564.8,"decode_EmbeddingF32_768_ns":1.62,"decode_EventLarge_ns":15.34,"decode_EventSmall_ns":7.19,"decode_InferenceResponse_ns":60.65,"decode_JsonLarge_ns":1831.53,"decode_JsonSmall_ns":117.36,"decode_LLMChunkLarge_ns":1273.54,"decode_LLMChunkSmall_ns":92.54,"decode_OrderLarge_ns":42.62,"decode_OrderSmall_ns":18.82,"decode_PersonMedium_ns":10.22,"decode_PersonSmall_ns":9.71,"decode_TensorShardLarge_ns":23.44,"decode_TensorShardSmall_ns":28.03,"decode_TreeDeep_ns":1616.69,"decode_TreeWide_ns":886.77},"status":"discard","description":"Force #[inline(always)] on read_str (was only #[inline])","timestamp":1774207836581,"segment":0,"confidence":18.430093352925912,"asi":{"hypothesis":"read_str with #[inline] might not be inlined at all call sites due to simdutf8 call making it \"too large\". Forcing #[inline(always)] should eliminate call overhead.","rollback_reason":"Within noise — the compiler was already inlining read_str at the important call sites with just #[inline].","next_action_hint":"Try removing checked_mul in read_scalar_array on 64-bit, or look at the generated message decode path for TreeWide/TreeDeep."}}
{"run":24,"commit":"chkmul1","metric":11833.32,"metrics":{"decode_ChunkedText_ns":2027.95,"decode_DocumentLarge_ns":3061.38,"decode_DocumentSmall_ns":74.73,"decode_Embedding1536_ns":2.4,"decode_Embedding384_ns":2.32,"decode_Embedding768_ns":2.32,"decode_EmbeddingBatch_ns":554.35,"decode_EmbeddingF32_768_ns":1.61,"decode_EventLarge_ns":13.5,"decode_EventSmall_ns":7.22,"decode_InferenceResponse_ns":62.47,"decode_JsonLarge_ns":1837.91,"decode_JsonSmall_ns":113.19,"decode_LLMChunkLarge_ns":1301.01,"decode_LLMChunkSmall_ns":90.41,"decode_OrderLarge_ns":45.83,"decode_OrderSmall_ns":19.47,"decode_PersonMedium_ns":11.89,"decode_PersonSmall_ns":8.82,"decode_TensorShardLarge_ns":22.94,"decode_TensorShardSmall_ns":27.95,"decode_TreeDeep_ns":1656.21,"decode_TreeWide_ns":887.45},"status":"discard","description":"Remove checked_mul in read_scalar_array on 64-bit platforms (overflow impossible)","timestamp":1774207882743,"segment":0,"confidence":19.502887001063357,"asi":{"hypothesis":"checked_mul in scalar array path adds unnecessary overflow check on 64-bit","rollback_reason":"Within noise — compiler likely already optimizes checked_mul to unchecked when it can prove no overflow via constant propagation of elem_size","next_action_hint":"Try generating message decoders without Default::default() init — use direct field assignment instead of mutating default"}}
{"run":25,"commit":"vinl01","metric":11957.93,"metrics":{"decode_ChunkedText_ns":2071.87,"decode_DocumentLarge_ns":3044.82,"decode_DocumentSmall_ns":70.74,"decode_Embedding1536_ns":2.58,"decode_Embedding384_ns":2.48,"decode_Embedding768_ns":2.39,"decode_EmbeddingBatch_ns":558.36,"decode_EmbeddingF32_768_ns":1.63,"decode_EventLarge_ns":12.89,"decode_EventSmall_ns":6.9,"decode_InferenceResponse_ns":65.09,"decode_JsonLarge_ns":1859.79,"decode_JsonSmall_ns":114.68,"decode_LLMChunkLarge_ns":1331.53,"decode_LLMChunkSmall_ns":93.25,"decode_OrderLarge_ns":51.34,"decode_OrderSmall_ns":18.84,"decode_PersonMedium_ns":11.49,"decode_PersonSmall_ns":9.84,"decode_TensorShardLarge_ns":20.12,"decode_TensorShardSmall_ns":28.01,"decode_TreeDeep_ns":1672.41,"decode_TreeWide_ns":906.89},"status":"discard","description":"Force #[inline(always)] on validate_utf8 wrapper","timestamp":1774207948426,"segment":0,"confidence":20.70829185383035,"asi":{"hypothesis":"Force-inlining validate_utf8 might eliminate simdutf8 call overhead","rollback_reason":"No improvement — simdutf8 is already effectively inlined by the compiler","next_action_hint":"The micro-optimization well is dry. Consider larger structural changes: switch to hashbrown HashMap (requires fixture changes), or try rewriting the message decode loop to avoid Default::default()."}}
{"run":26,"commit":"locvar1","metric":12122.54,"metrics":{"decode_ChunkedText_ns":2082.09,"decode_DocumentLarge_ns":3154,"decode_DocumentSmall_ns":71.36,"decode_Embedding1536_ns":2.37,"decode_Embedding384_ns":2.49,"decode_Embedding768_ns":2.48,"decode_EmbeddingBatch_ns":578.29,"decode_EmbeddingF32_768_ns":1.61,"decode_EventLarge_ns":13.14,"decode_EventSmall_ns":7.4,"decode_InferenceResponse_ns":66.11,"decode_JsonLarge_ns":1904.39,"decode_JsonSmall_ns":117.21,"decode_LLMChunkLarge_ns":1299.72,"decode_LLMChunkSmall_ns":95.56,"decode_OrderLarge_ns":44.77,"decode_OrderSmall_ns":19.2,"decode_PersonMedium_ns":11.57,"decode_PersonSmall_ns":10.1,"decode_TensorShardLarge_ns":29.13,"decode_TensorShardSmall_ns":28.79,"decode_TreeDeep_ns":1689.92,"decode_TreeWide_ns":890.84},"status":"discard","description":"Message decode: use local Option variables instead of Default::default() + struct mutation","timestamp":1774208055899,"segment":0,"confidence":21.657465718638942,"asi":{"hypothesis":"Local Option vars give optimizer more freedom than Default struct + field mutation — no aliasing through struct reference","rollback_reason":"No improvement — LLVM already optimizes the Default+mutation pattern equivalently to local vars. The patterns produce identical machine code.","next_action_hint":"Optimization plateau confirmed after 13 consecutive discards. Remaining bottlenecks (HashMap SipHash, recursive allocs, UTF-8 floor) require API-breaking changes."}}
{"run":27,"commit":"cachlen","metric":12308.39,"metrics":{"decode_ChunkedText_ns":2098.68,"decode_DocumentLarge_ns":3251.13,"decode_DocumentSmall_ns":80.66,"decode_Embedding1536_ns":2.41,"decode_Embedding384_ns":2.44,"decode_Embedding768_ns":2.37,"decode_EmbeddingBatch_ns":574.66,"decode_EmbeddingF32_768_ns":1.67,"decode_EventLarge_ns":12.9,"decode_EventSmall_ns":6.78,"decode_InferenceResponse_ns":65.6,"decode_JsonLarge_ns":1879.32,"decode_JsonSmall_ns":118.71,"decode_LLMChunkLarge_ns":1344.89,"decode_LLMChunkSmall_ns":93.27,"decode_OrderLarge_ns":45.73,"decode_OrderSmall_ns":18.74,"decode_PersonMedium_ns":11.67,"decode_PersonSmall_ns":9.45,"decode_TensorShardLarge_ns":24.58,"decode_TensorShardSmall_ns":30.51,"decode_TreeDeep_ns":1724.88,"decode_TreeWide_ns":907.34},"status":"discard","description":"Cache buf.len() as a struct field to avoid fat-pointer len loads in hot loops","timestamp":1774208262469,"segment":0,"confidence":22.69783100465735,"asi":{"hypothesis":"Caching buf.len() avoids repeated fat-pointer field loads, making it easier for LLVM to keep the length in a register across inlined reader calls","rollback_reason":"No improvement — LLVM already hoists buf.len() into a register across inlined code. The fat pointer load was not the bottleneck.","next_action_hint":"14 consecutive discards. The micro-optimization well is truly dry. Only API-breaking changes (hashbrown HashMap, SmallVec) can improve further."}}
{"run":28,"commit":"msginl1","metric":12275.83,"metrics":{"decode_ChunkedText_ns":2118.59,"decode_DocumentLarge_ns":3112.27,"decode_DocumentSmall_ns":76.28,"decode_Embedding1536_ns":2.29,"decode_Embedding384_ns":2.37,"decode_Embedding768_ns":2.28,"decode_EmbeddingBatch_ns":565.24,"decode_EmbeddingF32_768_ns":1.69,"decode_EventLarge_ns":13.31,"decode_EventSmall_ns":6.63,"decode_InferenceResponse_ns":61.85,"decode_JsonLarge_ns":1939.26,"decode_JsonSmall_ns":115.43,"decode_LLMChunkLarge_ns":1303.78,"decode_LLMChunkSmall_ns":94.09,"decode_OrderLarge_ns":47.66,"decode_OrderSmall_ns":19.11,"decode_PersonMedium_ns":11.5,"decode_PersonSmall_ns":10.41,"decode_TensorShardLarge_ns":23.12,"decode_TensorShardSmall_ns":27.62,"decode_TreeDeep_ns":1748.82,"decode_TreeWide_ns":972.25},"status":"discard","description":"Force #[inline(always)] on generated message and union decode methods (was #[inline])","timestamp":1774208369504,"segment":0,"confidence":22.42862778099194,"asi":{"hypothesis":"Force-inlining message/union decode could eliminate call overhead for small messages (Bool, Number, String) used in JsonLarge","rollback_reason":"Regression in TreeWide (+10%) — message decoders with tag loops are too large to force-inline. Code bloat hurts icache on TreeWide's 100 message decodes.","next_action_hint":"15 consecutive discards. This is definitively the optimization plateau. No further safe micro-optimizations are possible."}}
{"run":29,"commit":"hb01fix","metric":11338.61,"metrics":{"decode_ChunkedText_ns":2022.09,"decode_DocumentLarge_ns":2856.68,"decode_DocumentSmall_ns":66.9,"decode_Embedding1536_ns":2.38,"decode_Embedding384_ns":2.38,"decode_Embedding768_ns":2.38,"decode_EmbeddingBatch_ns":562.08,"decode_EmbeddingF32_768_ns":1.61,"decode_EventLarge_ns":14.38,"decode_EventSmall_ns":7.02,"decode_InferenceResponse_ns":68.94,"decode_JsonLarge_ns":1531.98,"decode_JsonSmall_ns":96.6,"decode_LLMChunkLarge_ns":1282.92,"decode_LLMChunkSmall_ns":89.75,"decode_OrderLarge_ns":48.96,"decode_OrderSmall_ns":19.15,"decode_PersonMedium_ns":10.77,"decode_PersonSmall_ns":10.48,"decode_TensorShardLarge_ns":22.13,"decode_TensorShardSmall_ns":27.94,"decode_TreeDeep_ns":1714.72,"decode_TreeWide_ns":876.37},"status":"checks_failed","description":"hashbrown HashMap (always use instead of std) — checks failed on import ordering","timestamp":1774209440011,"segment":0,"confidence":22.69783100465735,"asi":{"hypothesis":"Always use hashbrown::HashMap (foldhash) instead of std::collections::HashMap (SipHash)","rollback_reason":"rustfmt import ordering issue, fixing and re-running","next_action_hint":"Fix import order and retry","promising_result":"JsonLarge 1836→1532 (-16.5%), JsonSmall 110→96 (-12.7%), DocumentSmall 77→67 (-13%)"}}
{"run":30,"commit":"112b2d0","metric":11338.14,"metrics":{"decode_ChunkedText_ns":2048.19,"decode_DocumentLarge_ns":2908.88,"decode_DocumentSmall_ns":71.44,"decode_Embedding1536_ns":2.4,"decode_Embedding384_ns":2.38,"decode_Embedding768_ns":2.37,"decode_EmbeddingBatch_ns":573.84,"decode_EmbeddingF32_768_ns":1.61,"decode_EventLarge_ns":13.96,"decode_EventSmall_ns":6.74,"decode_InferenceResponse_ns":62.5,"decode_JsonLarge_ns":1512.01,"decode_JsonSmall_ns":89.88,"decode_LLMChunkLarge_ns":1239.16,"decode_LLMChunkSmall_ns":102.94,"decode_OrderLarge_ns":46.62,"decode_OrderSmall_ns":18.82,"decode_PersonMedium_ns":11.4,"decode_PersonSmall_ns":9.49,"decode_TensorShardLarge_ns":21.06,"decode_TensorShardSmall_ns":28.26,"decode_TreeDeep_ns":1675.88,"decode_TreeWide_ns":888.32},"status":"keep","description":"Always use hashbrown::HashMap (foldhash) instead of std HashMap (SipHash) — breaking API change","timestamp":1774209558911,"segment":0,"confidence":22.153555104113803,"asi":{"hypothesis":"hashbrown::HashMap uses foldhash which is much faster than SipHash for small keys. Map-heavy scenarios (JsonLarge, JsonSmall, DocumentSmall) should improve significantly.","breaking_change":true,"JsonLarge_improvement":"-17.7%","JsonSmall_improvement":"-18.9%","total_improvement_vs_baseline":"43.5%"}}
{"run":31,"commit":"abl_gu1","metric":11511.95,"metrics":{"decode_ChunkedText_ns":2015.28,"decode_DocumentLarge_ns":2954.2,"decode_DocumentSmall_ns":70.03,"decode_Embedding1536_ns":2.36,"decode_Embedding384_ns":2.41,"decode_Embedding768_ns":2.55,"decode_EmbeddingBatch_ns":561.23,"decode_EmbeddingF32_768_ns":1.66,"decode_EventLarge_ns":14.95,"decode_EventSmall_ns":7.16,"decode_InferenceResponse_ns":68.33,"decode_JsonLarge_ns":1604.83,"decode_JsonSmall_ns":102.46,"decode_LLMChunkLarge_ns":1292.98,"decode_LLMChunkSmall_ns":92.04,"decode_OrderLarge_ns":43.6,"decode_OrderSmall_ns":18.83,"decode_PersonMedium_ns":9.79,"decode_PersonSmall_ns":9.53,"decode_TensorShardLarge_ns":22.79,"decode_TensorShardSmall_ns":27.07,"decode_TreeDeep_ns":1731.86,"decode_TreeWide_ns":856},"status":"discard","description":"ABLATION: Remove get_unchecked from read_byte/read_bool (use safe indexing)","timestamp":1774209652658,"segment":0,"confidence":21.182639310428627,"asi":{"hypothesis":"Ablation: test if get_unchecked in read_byte/read_bool is needed, or if LLVM eliminates bounds check after pos < buf.len()","rollback_reason":"+173ns (+1.5%) — borderline, within noise floor. Suggests get_unchecked may not be needed here.","finding":"Safe indexing after bounds check is likely equivalent — LLVM can prove no panic","next_action_hint":"Try ablation of get_unchecked in read_str/read_string too, then combined ablation"}}
{"run":32,"commit":"2428b74","metric":11339.99,"metrics":{"decode_ChunkedText_ns":2012.65,"decode_DocumentLarge_ns":2864.12,"decode_DocumentSmall_ns":66.77,"decode_Embedding1536_ns":2.37,"decode_Embedding384_ns":2.36,"decode_Embedding768_ns":2.35,"decode_EmbeddingBatch_ns":554.92,"decode_EmbeddingF32_768_ns":1.6,"decode_EventLarge_ns":12.32,"decode_EventSmall_ns":7.24,"decode_InferenceResponse_ns":59.02,"decode_JsonLarge_ns":1526.59,"decode_JsonSmall_ns":93.16,"decode_LLMChunkLarge_ns":1273.11,"decode_LLMChunkSmall_ns":91.29,"decode_OrderLarge_ns":45.09,"decode_OrderSmall_ns":19.6,"decode_PersonMedium_ns":10.47,"decode_PersonSmall_ns":9.03,"decode_TensorShardLarge_ns":23.63,"decode_TensorShardSmall_ns":27.71,"decode_TreeDeep_ns":1750.59,"decode_TreeWide_ns":884.01},"status":"keep","description":"ABLATION: Remove ALL get_unchecked from read_byte/read_bool/read_str/read_string — safe indexing is equally fast","timestamp":1774209710596,"segment":0,"confidence":21.031484294014106,"asi":{"hypothesis":"Ablation: test whether get_unchecked in read_byte/read_bool/read_str/read_string provides any benefit over safe indexing","finding":"LLVM eliminates redundant bounds checks after manual if/end checks. All get_unchecked in these functions was unnecessary unsafe code.","simplification":"Removed 4 unsafe blocks from hot paths with zero performance cost","note":"from_utf8_unchecked still kept since validate_utf8() is a separate function LLVM cannot prove guarantees from"}}
