{"type":"config","name":"Rust Bebop decode performance vs C","metricName":"total_decode_ns","metricUnit":"ns","bestDirection":"lower"}
{"run":1,"commit":"896136c","metric":20062.21,"metrics":{"decode_ChunkedText_ns":4522.63,"decode_DocumentLarge_ns":6244.7,"decode_DocumentSmall_ns":97.69,"decode_Embedding1536_ns":7.65,"decode_Embedding384_ns":6.77,"decode_Embedding768_ns":7.55,"decode_EmbeddingBatch_ns":539.56,"decode_EmbeddingF32_768_ns":7.35,"decode_EventLarge_ns":15.98,"decode_EventSmall_ns":10.89,"decode_InferenceResponse_ns":96.18,"decode_JsonLarge_ns":2625.61,"decode_JsonSmall_ns":156.26,"decode_LLMChunkLarge_ns":1935.22,"decode_LLMChunkSmall_ns":121.42,"decode_OrderLarge_ns":52.13,"decode_OrderSmall_ns":22.12,"decode_PersonMedium_ns":14.91,"decode_PersonSmall_ns":15.39,"decode_TensorShardLarge_ns":29.46,"decode_TensorShardSmall_ns":33.13,"decode_TreeDeep_ns":2279.96,"decode_TreeWide_ns":1219.68},"status":"keep","description":"Baseline: total decode across all scenarios","timestamp":1774204341402,"segment":0,"confidence":null,"asi":{"hypothesis":"Baseline measurement of all decode scenario times"}}
{"run":2,"commit":"eb9c418","metric":17972.81,"metrics":{"decode_ChunkedText_ns":4601.53,"decode_DocumentLarge_ns":5763.9,"decode_DocumentSmall_ns":82.31,"decode_Embedding1536_ns":6.12,"decode_Embedding384_ns":5.98,"decode_Embedding768_ns":6.02,"decode_EmbeddingBatch_ns":562.55,"decode_EmbeddingF32_768_ns":6.45,"decode_EventLarge_ns":14.94,"decode_EventSmall_ns":8.97,"decode_InferenceResponse_ns":70.11,"decode_JsonLarge_ns":2051.63,"decode_JsonSmall_ns":118.8,"decode_LLMChunkLarge_ns":1733.83,"decode_LLMChunkSmall_ns":109.58,"decode_OrderLarge_ns":44.54,"decode_OrderSmall_ns":18.44,"decode_PersonMedium_ns":12.75,"decode_PersonSmall_ns":11.18,"decode_TensorShardLarge_ns":27.06,"decode_TensorShardSmall_ns":30.15,"decode_TreeDeep_ns":1777.15,"decode_TreeWide_ns":908.82},"status":"keep","description":"Add #[inline(always)] to all reader primitives + read_n<N> const-generic for single bounds check","timestamp":1774204536229,"segment":0,"confidence":null,"asi":{"hypothesis":"Cross-crate inlining was missing. Adding #[inline(always)] on all reader methods + read_n<const N> to eliminate redundant bounds checks (ensure+slice+try_into replaced by single check+ptr read)","biggest_wins":"TreeDeep -22%, TreeWide -25%, JsonSmall -24%, InferenceResponse -27%"}}
{"run":3,"commit":"traits0","metric":18101.52,"metrics":{"decode_ChunkedText_ns":4609.44,"decode_DocumentLarge_ns":5998.25,"decode_DocumentSmall_ns":82.88,"decode_Embedding1536_ns":5.87,"decode_Embedding384_ns":5.83,"decode_Embedding768_ns":5.85,"decode_EmbeddingBatch_ns":553.61,"decode_EmbeddingF32_768_ns":6.29,"decode_EventLarge_ns":16.2,"decode_EventSmall_ns":8.74,"decode_InferenceResponse_ns":68.41,"decode_JsonLarge_ns":2082.82,"decode_JsonSmall_ns":121.07,"decode_LLMChunkLarge_ns":1654.7,"decode_LLMChunkSmall_ns":102.26,"decode_OrderLarge_ns":48.23,"decode_OrderSmall_ns":18.41,"decode_PersonMedium_ns":12.53,"decode_PersonSmall_ns":11.25,"decode_TensorShardLarge_ns":25.63,"decode_TensorShardSmall_ns":29.92,"decode_TreeDeep_ns":1725.46,"decode_TreeWide_ns":907.88},"status":"discard","description":"Add #[inline(always)] to FixedScalar/BebopFlagBits trait impl methods","timestamp":1774204661010,"segment":0,"confidence":16.23339289876476,"asi":{"hypothesis":"FixedScalar/BebopFlagBits impl methods missing #[inline] could hurt read_fixed_array and fallback paths","rollback_reason":"Within noise, no measurable improvement","next_action_hint":"Focus on higher-level optimizations: reduce allocations, optimize message/union tag loops"}}
{"run":4,"commit":"6dd5898","metric":17717.78,"metrics":{"decode_ChunkedText_ns":4776.64,"decode_DocumentLarge_ns":5690.97,"decode_DocumentSmall_ns":89.46,"decode_Embedding1536_ns":7.37,"decode_Embedding384_ns":6.72,"decode_Embedding768_ns":6.74,"decode_EmbeddingBatch_ns":568,"decode_EmbeddingF32_768_ns":6,"decode_EventLarge_ns":15.74,"decode_EventSmall_ns":9.04,"decode_InferenceResponse_ns":72.22,"decode_JsonLarge_ns":2094.84,"decode_JsonSmall_ns":126.25,"decode_LLMChunkLarge_ns":1325.9,"decode_LLMChunkSmall_ns":100.12,"decode_OrderLarge_ns":43.69,"decode_OrderSmall_ns":17.48,"decode_PersonMedium_ns":12.07,"decode_PersonSmall_ns":11.11,"decode_TensorShardLarge_ns":24.15,"decode_TensorShardSmall_ns":29.3,"decode_TreeDeep_ns":1782.63,"decode_TreeWide_ns":901.37},"status":"keep","description":"Optimize read_byte/read_bool (avoid checked_add, use get_unchecked) + read_str/read_string (combine bounds checks, use get_unchecked)","timestamp":1774204847785,"segment":0,"confidence":12.218846093709233,"asi":{"hypothesis":"read_byte (used for every message tag) has unnecessary checked_add overhead. read_str has redundant ensure+slice bounds checks. Using get_unchecked after manual check reduces per-call overhead.","biggest_wins":"LLMChunkLarge -24% (many string reads), PersonMedium -5%"}}
{"run":5,"commit":"misc01","metric":18017.4,"metrics":{"decode_ChunkedText_ns":4837.98,"decode_DocumentLarge_ns":5921.55,"decode_DocumentSmall_ns":84.47,"decode_Embedding1536_ns":6.49,"decode_Embedding384_ns":6.54,"decode_Embedding768_ns":6.71,"decode_EmbeddingBatch_ns":573.32,"decode_EmbeddingF32_768_ns":6.02,"decode_EventLarge_ns":15.9,"decode_EventSmall_ns":8.8,"decode_InferenceResponse_ns":73.8,"decode_JsonLarge_ns":2066.01,"decode_JsonSmall_ns":124.2,"decode_LLMChunkLarge_ns":1340.99,"decode_LLMChunkSmall_ns":98.38,"decode_OrderLarge_ns":43.36,"decode_OrderSmall_ns":18.39,"decode_PersonMedium_ns":13.19,"decode_PersonSmall_ns":12.3,"decode_TensorShardLarge_ns":24.77,"decode_TensorShardSmall_ns":28.47,"decode_TreeDeep_ns":1789.93,"decode_TreeWide_ns":915.86},"status":"discard","description":"Add #[inline] to from_bytes + optimize read_raw_bytes with get_unchecked","timestamp":1774204957645,"segment":0,"confidence":27.870066571564774,"asi":{"hypothesis":"from_bytes inline + read_raw_bytes get_unchecked might reduce overhead for byte-heavy types","rollback_reason":"No measurable improvement, within noise","next_action_hint":"Try code generator optimizations or look at the EmbeddingBatch decode pattern for array-of-struct improvements"}}
{"run":6,"commit":"e164658","metric":16941.97,"metrics":{"decode_ChunkedText_ns":4562.12,"decode_DocumentLarge_ns":5404.08,"decode_DocumentSmall_ns":81.01,"decode_Embedding1536_ns":2.11,"decode_Embedding384_ns":2.02,"decode_Embedding768_ns":2.21,"decode_EmbeddingBatch_ns":556.05,"decode_EmbeddingF32_768_ns":1.49,"decode_EventLarge_ns":12.93,"decode_EventSmall_ns":6.18,"decode_InferenceResponse_ns":65.93,"decode_JsonLarge_ns":1902.54,"decode_JsonSmall_ns":119.74,"decode_LLMChunkLarge_ns":1280.6,"decode_LLMChunkSmall_ns":103.39,"decode_OrderLarge_ns":48.24,"decode_OrderSmall_ns":22.54,"decode_PersonMedium_ns":10.59,"decode_PersonSmall_ns":8.97,"decode_TensorShardLarge_ns":26.08,"decode_TensorShardSmall_ns":31.26,"decode_TreeDeep_ns":1793.98,"decode_TreeWide_ns":897.9},"status":"keep","description":"Add #[inline] to all generated decode methods (struct, message, union, enum) via code generator","timestamp":1774205300421,"segment":0,"confidence":16.26226090582157,"asi":{"hypothesis":"Generated decode methods without #[inline] cause function call overhead when called from arrays and nested types","biggest_wins":"Embedding1536 -71%, EmbeddingF32_768 -76%, EventSmall -43%, PersonSmall -19%"}}
{"run":7,"commit":"cold01","metric":17428.37,"metrics":{"decode_ChunkedText_ns":4688.45,"decode_DocumentLarge_ns":5593.75,"decode_DocumentSmall_ns":80.88,"decode_Embedding1536_ns":5.06,"decode_Embedding384_ns":4.34,"decode_Embedding768_ns":5.08,"decode_EmbeddingBatch_ns":547.77,"decode_EmbeddingF32_768_ns":4.24,"decode_EventLarge_ns":15.52,"decode_EventSmall_ns":8.82,"decode_InferenceResponse_ns":81.61,"decode_JsonLarge_ns":1890.4,"decode_JsonSmall_ns":113.3,"decode_LLMChunkLarge_ns":1354.62,"decode_LLMChunkSmall_ns":95.06,"decode_OrderLarge_ns":44.03,"decode_OrderSmall_ns":17.62,"decode_PersonMedium_ns":12.52,"decode_PersonSmall_ns":11.32,"decode_TensorShardLarge_ns":24.81,"decode_TensorShardSmall_ns":29.59,"decode_TreeDeep_ns":1726.09,"decode_TreeWide_ns":1073.48},"status":"discard","description":"Mark error path eof_error as #[cold] #[inline(never)] to improve branch prediction","timestamp":1774205511512,"segment":0,"confidence":12.23479590636383,"asi":{"hypothesis":"#[cold] error path should improve branch prediction by keeping fast path hot","rollback_reason":"Regression across board — Embeddings 2x worse, TreeWide +19%. #[inline(never)] may cause unfavorable code layout changes","next_action_hint":"Try read_str optimization for large strings or batch bounds checking in message decode"}}
{"run":8,"commit":"ts12b","metric":16963.87,"metrics":{"decode_ChunkedText_ns":4425.77,"decode_DocumentLarge_ns":5493.37,"decode_DocumentSmall_ns":76.02,"decode_Embedding1536_ns":2.05,"decode_Embedding384_ns":2.11,"decode_Embedding768_ns":1.99,"decode_EmbeddingBatch_ns":574.55,"decode_EmbeddingF32_768_ns":1.56,"decode_EventLarge_ns":12.92,"decode_EventSmall_ns":6.46,"decode_InferenceResponse_ns":68.21,"decode_JsonLarge_ns":1865,"decode_JsonSmall_ns":112.81,"decode_LLMChunkLarge_ns":1353.9,"decode_LLMChunkSmall_ns":97.66,"decode_OrderLarge_ns":44.74,"decode_OrderSmall_ns":18.69,"decode_PersonMedium_ns":10.42,"decode_PersonSmall_ns":9.06,"decode_TensorShardLarge_ns":26.4,"decode_TensorShardSmall_ns":30.47,"decode_TreeDeep_ns":1838.45,"decode_TreeWide_ns":891.26},"status":"discard","description":"Single 12-byte read for timestamp/duration instead of two separate reads","timestamp":1774205597500,"segment":0,"confidence":9.270563767362374,"asi":{"hypothesis":"Combined 12-byte read for timestamp/duration saves 1 bounds check per call","rollback_reason":"No measurable improvement — timestamps aren't hot in current benchmarks","next_action_hint":"Try optimizing generated message decode pattern or look at HashMap alternative"}}
{"run":9,"commit":"msgtag1","metric":17519.14,"metrics":{"decode_ChunkedText_ns":4672.17,"decode_DocumentLarge_ns":5834.47,"decode_DocumentSmall_ns":80.27,"decode_Embedding1536_ns":2.2,"decode_Embedding384_ns":2.17,"decode_Embedding768_ns":2.23,"decode_EmbeddingBatch_ns":550.92,"decode_EmbeddingF32_768_ns":1.65,"decode_EventLarge_ns":12.71,"decode_EventSmall_ns":6.21,"decode_InferenceResponse_ns":71,"decode_JsonLarge_ns":1885.43,"decode_JsonSmall_ns":120.48,"decode_LLMChunkLarge_ns":1322.33,"decode_LLMChunkSmall_ns":98.89,"decode_OrderLarge_ns":43.55,"decode_OrderSmall_ns":18.25,"decode_PersonMedium_ns":10.31,"decode_PersonSmall_ns":8.64,"decode_TensorShardLarge_ns":25.9,"decode_TensorShardSmall_ns":29.59,"decode_TreeDeep_ns":1837.46,"decode_TreeWide_ns":882.31},"status":"discard","description":"Validated message boundary + combined next_message_tag with bounds-skip for tag reads","timestamp":1774205731963,"segment":0,"confidence":10.413991055336663,"asi":{"hypothesis":"Validating message body boundary upfront allows skipping per-tag bounds checks in the tag loop","rollback_reason":"No improvement — on aarch64 M-series, branch prediction makes the read_byte bounds check effectively free. The extra validation in read_validated_message_end adds overhead.","next_action_hint":"Focus on reducing allocations or try SIMD UTF-8 validation. Or explore generated code for struct decode with batch reads."}}
{"run":10,"commit":"684ac58","metric":16486.55,"metrics":{"decode_ChunkedText_ns":4339.87,"decode_DocumentLarge_ns":5465.2,"decode_DocumentSmall_ns":71.04,"decode_Embedding1536_ns":1.93,"decode_Embedding384_ns":1.96,"decode_Embedding768_ns":1.92,"decode_EmbeddingBatch_ns":554.65,"decode_EmbeddingF32_768_ns":1.51,"decode_EventLarge_ns":12.19,"decode_EventSmall_ns":6.45,"decode_InferenceResponse_ns":66.31,"decode_JsonLarge_ns":1773.91,"decode_JsonSmall_ns":114.51,"decode_LLMChunkLarge_ns":1290.37,"decode_LLMChunkSmall_ns":99.07,"decode_OrderLarge_ns":44.31,"decode_OrderSmall_ns":26.3,"decode_PersonMedium_ns":9.55,"decode_PersonSmall_ns":8.36,"decode_TensorShardLarge_ns":26.9,"decode_TensorShardSmall_ns":31.54,"decode_TreeDeep_ns":1647.64,"decode_TreeWide_ns":891.05},"status":"keep","description":"Replace Vec::new()+try_reserve with Vec::with_capacity in read_array; HashMap::new()+try_reserve with HashMap::with_capacity in read_map","timestamp":1774205858980,"segment":0,"confidence":8.108072562358243,"asi":{"hypothesis":"try_reserve has overhead from error-handling path and Result wrapping. with_capacity is simpler (panics on OOM instead of returning error)","biggest_wins":"TreeDeep -8%, JsonLarge -7%, DocumentSmall -12%"}}
{"run":11,"commit":"7a199c0","metric":11830.59,"metrics":{"decode_ChunkedText_ns":2043.02,"decode_DocumentLarge_ns":2957.33,"decode_DocumentSmall_ns":76.78,"decode_Embedding1536_ns":2.2,"decode_Embedding384_ns":2.23,"decode_Embedding768_ns":2.12,"decode_EmbeddingBatch_ns":564.53,"decode_EmbeddingF32_768_ns":1.71,"decode_EventLarge_ns":12.82,"decode_EventSmall_ns":7.94,"decode_InferenceResponse_ns":64.61,"decode_JsonLarge_ns":1890.49,"decode_JsonSmall_ns":117.98,"decode_LLMChunkLarge_ns":1326.38,"decode_LLMChunkSmall_ns":93.67,"decode_OrderLarge_ns":41.84,"decode_OrderSmall_ns":17.88,"decode_PersonMedium_ns":11.02,"decode_PersonSmall_ns":10.7,"decode_TensorShardLarge_ns":31.38,"decode_TensorShardSmall_ns":29.25,"decode_TreeDeep_ns":1617.76,"decode_TreeWide_ns":906.95},"status":"keep","description":"Use simdutf8 for SIMD-accelerated UTF-8 validation in read_str and read_string","timestamp":1774205952135,"segment":0,"confidence":14.82453581140705,"asi":{"hypothesis":"simdutf8 uses NEON SIMD instructions for UTF-8 validation on aarch64, dramatically faster than core::str::from_utf8 for large buffers","biggest_wins":"ChunkedText -53%, DocumentLarge -46%"}}
{"run":12,"commit":"aab3940","metric":11709.54,"metrics":{"decode_ChunkedText_ns":2014.48,"decode_DocumentLarge_ns":3102.35,"decode_DocumentSmall_ns":74.48,"decode_Embedding1536_ns":2.43,"decode_Embedding384_ns":2.23,"decode_Embedding768_ns":2.44,"decode_EmbeddingBatch_ns":555.28,"decode_EmbeddingF32_768_ns":1.56,"decode_EventLarge_ns":13.73,"decode_EventSmall_ns":7.15,"decode_InferenceResponse_ns":58.06,"decode_JsonLarge_ns":1798.24,"decode_JsonSmall_ns":112.98,"decode_LLMChunkLarge_ns":1257.92,"decode_LLMChunkSmall_ns":89.25,"decode_OrderLarge_ns":43.4,"decode_OrderSmall_ns":18.04,"decode_PersonMedium_ns":10.77,"decode_PersonSmall_ns":10.07,"decode_TensorShardLarge_ns":21.92,"decode_TensorShardSmall_ns":27.58,"decode_TreeDeep_ns":1590.69,"decode_TreeWide_ns":894.5},"status":"keep","description":"Use #[inline(always)] on generated struct decode methods (structs are small, benefit from forced inlining)","timestamp":1774206053591,"segment":0,"confidence":15.533637707707607,"asi":{"hypothesis":"#[inline(always)] on struct decode forces inlining even in array contexts where compiler might not inline","biggest_wins":"InferenceResponse -10%, TensorShardLarge -16%, LLMChunkSmall -14%"}}
{"run":13,"commit":"d0d1527","metric":11533.5,"metrics":{"decode_ChunkedText_ns":1969.06,"decode_DocumentLarge_ns":3030.3,"decode_DocumentSmall_ns":77.01,"decode_Embedding1536_ns":2.3,"decode_Embedding384_ns":2.3,"decode_Embedding768_ns":2.36,"decode_EmbeddingBatch_ns":549.75,"decode_EmbeddingF32_768_ns":1.62,"decode_EventLarge_ns":13.78,"decode_EventSmall_ns":6.09,"decode_InferenceResponse_ns":66.85,"decode_JsonLarge_ns":1836.65,"decode_JsonSmall_ns":110.57,"decode_LLMChunkLarge_ns":1201.52,"decode_LLMChunkSmall_ns":91.45,"decode_OrderLarge_ns":45.2,"decode_OrderSmall_ns":17.9,"decode_PersonMedium_ns":11.83,"decode_PersonSmall_ns":11.98,"decode_TensorShardLarge_ns":23.85,"decode_TensorShardSmall_ns":27.77,"decode_TreeDeep_ns":1578.98,"decode_TreeWide_ns":854.4},"status":"keep","description":"Use #[inline(always)] on generated enum decode methods (enums are trivial)","timestamp":1774206108447,"segment":0,"confidence":14.479245539276375,"asi":{"hypothesis":"Enum decode methods are trivial (1 byte read + match), always inlining avoids call overhead in struct/message decoders","biggest_wins":"TreeWide -4%, LLMChunkLarge -4%"}}
{"run":14,"commit":"wrinl1","metric":11808.83,"metrics":{"decode_ChunkedText_ns":1985.62,"decode_DocumentLarge_ns":3154.67,"decode_DocumentSmall_ns":78.59,"decode_Embedding1536_ns":1.65,"decode_Embedding384_ns":1.62,"decode_Embedding768_ns":1.67,"decode_EmbeddingBatch_ns":514.12,"decode_EmbeddingF32_768_ns":1.55,"decode_EventLarge_ns":14.61,"decode_EventSmall_ns":6.27,"decode_InferenceResponse_ns":61.51,"decode_JsonLarge_ns":1919.89,"decode_JsonSmall_ns":113.54,"decode_LLMChunkLarge_ns":1203.58,"decode_LLMChunkSmall_ns":86.33,"decode_OrderLarge_ns":46.6,"decode_OrderSmall_ns":17.05,"decode_PersonMedium_ns":9.77,"decode_PersonSmall_ns":9.26,"decode_TensorShardLarge_ns":21.31,"decode_TensorShardSmall_ns":25.47,"decode_TreeDeep_ns":1662.58,"decode_TreeWide_ns":871.58},"status":"discard","description":"Add #[inline] to all writer methods + with_capacity in scalar_array fallbacks","timestamp":1774206205178,"segment":0,"confidence":10.674430683930204,"asi":{"hypothesis":"Writer inline annotations might improve icache locality for decode by making encode code smaller. Scalar array fallback with_capacity avoids try_reserve overhead.","rollback_reason":"No improvement, likely code bloat from too much inlining hurt instruction cache performance","next_action_hint":"Try focusing on a single hot path optimization, maybe read_array closure elimination or enum TryFrom optimization"}}
{"run":15,"commit":"shortst","metric":11911.78,"metrics":{"decode_ChunkedText_ns":2113.56,"decode_DocumentLarge_ns":3090.9,"decode_DocumentSmall_ns":74.17,"decode_Embedding1536_ns":2.48,"decode_Embedding384_ns":2.59,"decode_Embedding768_ns":2.53,"decode_EmbeddingBatch_ns":587.97,"decode_EmbeddingF32_768_ns":1.57,"decode_EventLarge_ns":14.03,"decode_EventSmall_ns":6.47,"decode_InferenceResponse_ns":61.01,"decode_JsonLarge_ns":1874.95,"decode_JsonSmall_ns":114.04,"decode_LLMChunkLarge_ns":1242.1,"decode_LLMChunkSmall_ns":91.09,"decode_OrderLarge_ns":42.9,"decode_OrderSmall_ns":18.43,"decode_PersonMedium_ns":10.17,"decode_PersonSmall_ns":9.66,"decode_TensorShardLarge_ns":24.02,"decode_TensorShardSmall_ns":24.38,"decode_TreeDeep_ns":1616.75,"decode_TreeWide_ns":886.01},"status":"discard","description":"Split UTF-8 validation: std for <64 bytes, simdutf8 for >=64 bytes","timestamp":1774206396265,"segment":0,"confidence":8.09536510588211,"asi":{"hypothesis":"Short strings might be faster with std from_utf8 vs simdutf8 due to SIMD setup overhead","rollback_reason":"No improvement — extra branch adds overhead, simdutf8 already handles short strings well","next_action_hint":"Try batch struct decode for fixed-size structs, or focus on reducing allocations in recursive types"}}
{"run":16,"commit":"decarr1","metric":12098.58,"metrics":{"decode_ChunkedText_ns":2059.25,"decode_DocumentLarge_ns":3219.57,"decode_DocumentSmall_ns":75.99,"decode_Embedding1536_ns":2.35,"decode_Embedding384_ns":2.24,"decode_Embedding768_ns":2.1,"decode_EmbeddingBatch_ns":510.95,"decode_EmbeddingF32_768_ns":1.72,"decode_EventLarge_ns":13.37,"decode_EventSmall_ns":7.07,"decode_InferenceResponse_ns":62.45,"decode_JsonLarge_ns":1876.56,"decode_JsonSmall_ns":120.15,"decode_LLMChunkLarge_ns":1381.71,"decode_LLMChunkSmall_ns":89.46,"decode_OrderLarge_ns":44.51,"decode_OrderSmall_ns":18.09,"decode_PersonMedium_ns":10.55,"decode_PersonSmall_ns":9.72,"decode_TensorShardLarge_ns":25.33,"decode_TensorShardSmall_ns":28.12,"decode_TreeDeep_ns":1635.19,"decode_TreeWide_ns":902.13},"status":"discard","description":"Add read_decode_array (direct trait dispatch instead of closure) for struct array decode","timestamp":1774206699608,"segment":0,"confidence":7.707547851862543,"asi":{"hypothesis":"Direct trait dispatch in read_decode_array might avoid closure overhead","rollback_reason":"No improvement — Rust's monomorphization already inlines the closure effectively, no actual closure indirection","next_action_hint":"Reaching diminishing returns on low-level optimizations. Remaining bottlenecks are structural: HashMap SipHash, recursive allocations, UTF-8 validation. Consider the batch struct decode with enum support or accept current 42.5% improvement."}}
{"run":17,"commit":"simdcfg","metric":12121.39,"metrics":{"decode_ChunkedText_ns":2099.97,"decode_DocumentLarge_ns":3174.97,"decode_DocumentSmall_ns":75.08,"decode_Embedding1536_ns":2.46,"decode_Embedding384_ns":2.43,"decode_Embedding768_ns":2.47,"decode_EmbeddingBatch_ns":562.09,"decode_EmbeddingF32_768_ns":1.65,"decode_EventLarge_ns":12.52,"decode_EventSmall_ns":6.83,"decode_InferenceResponse_ns":58.83,"decode_JsonLarge_ns":1946.99,"decode_JsonSmall_ns":114.51,"decode_LLMChunkLarge_ns":1237.16,"decode_LLMChunkSmall_ns":94.05,"decode_OrderLarge_ns":44.82,"decode_OrderSmall_ns":18.89,"decode_PersonMedium_ns":11.6,"decode_PersonSmall_ns":9.57,"decode_TensorShardLarge_ns":24.4,"decode_TensorShardSmall_ns":30.8,"decode_TreeDeep_ns":1689.74,"decode_TreeWide_ns":899.57},"status":"discard","description":"Use simdutf8 with default features instead of aarch64_neon-only","timestamp":1774206783175,"segment":0,"confidence":7.355189513173218,"asi":{"hypothesis":"Default simdutf8 features might auto-detect NEON","rollback_reason":"No improvement, within noise. aarch64_neon feature is already optimal.","next_action_hint":"Exhausted easy optimizations. Consider batch struct decode with enum support, or accept current 42.5% improvement."}}
