{"run":33,"commit":"372b079","metric":11523.75,"metrics":{"decode_ChunkedText_ns":2088.58,"decode_DocumentLarge_ns":2882.78,"decode_DocumentSmall_ns":73.03,"decode_Embedding1536_ns":2.46,"decode_Embedding384_ns":2.4,"decode_Embedding768_ns":2.4,"decode_EmbeddingBatch_ns":558.49,"decode_EmbeddingF32_768_ns":1.66,"decode_EventLarge_ns":13.01,"decode_EventSmall_ns":6.46,"decode_InferenceResponse_ns":64.98,"decode_JsonLarge_ns":1615.33,"decode_JsonSmall_ns":94.03,"decode_LLMChunkLarge_ns":1265.24,"decode_LLMChunkSmall_ns":95.69,"decode_OrderLarge_ns":43.53,"decode_OrderSmall_ns":18.03,"decode_PersonMedium_ns":10.82,"decode_PersonSmall_ns":9.87,"decode_TensorShardLarge_ns":23.88,"decode_TensorShardSmall_ns":29.08,"decode_TreeDeep_ns":1742.96,"decode_TreeWide_ns":879.02},"status":"keep","description":"ABLATION: Eliminate from_utf8_unchecked — use simdutf8's direct &str return. Removes 2 more unsafe blocks.","timestamp":1774209820368,"segment":0,"confidence":20.88247121621943,"asi":{"hypothesis":"Ablation: replace validate_utf8() bool + from_utf8_unchecked with simdutf8::basic::from_utf8() returning &str directly","finding":"Same performance within noise. simdutf8 already returns validated &str, so the unchecked conversion was redundant unsafe.","simplification":"Eliminated 2 more unsafe blocks (read_str, read_string). Only remaining unsafe in reader: read_n (ptr read), read_scalar_array (bulk memcpy).","note":"+1.6% within noise floor, code safety improvement justifies keeping"}}
{"run":34,"commit":"886735f","metric":11446.23,"metrics":{"decode_ChunkedText_ns":1999.86,"decode_DocumentLarge_ns":2920.58,"decode_DocumentSmall_ns":73.62,"decode_Embedding1536_ns":2.22,"decode_Embedding384_ns":2.25,"decode_Embedding768_ns":2.27,"decode_EmbeddingBatch_ns":576.97,"decode_EmbeddingF32_768_ns":1.68,"decode_EventLarge_ns":12,"decode_EventSmall_ns":6.37,"decode_InferenceResponse_ns":61,"decode_JsonLarge_ns":1540.74,"decode_JsonSmall_ns":99.34,"decode_LLMChunkLarge_ns":1303.89,"decode_LLMChunkSmall_ns":91.33,"decode_OrderLarge_ns":45.35,"decode_OrderSmall_ns":18.06,"decode_PersonMedium_ns":10.32,"decode_PersonSmall_ns":9.13,"decode_TensorShardLarge_ns":22.96,"decode_TensorShardSmall_ns":27.83,"decode_TreeDeep_ns":1697.37,"decode_TreeWide_ns":921.08},"status":"keep","description":"ABLATION: Replace unsafe ptr::read_unaligned in read_n with safe ensure+slice+try_into — eliminates another unsafe block","timestamp":1774209870984,"segment":0,"confidence":18.62167815748469,"asi":{"hypothesis":"Ablation: test if unsafe ptr::read_unaligned in read_n is needed, or if safe slice+try_into generates identical code","finding":"LLVM optimizes buf[pos..pos+N].try_into().unwrap() identically to ptr::read_unaligned when N is a const generic. No performance difference.","simplification":"Eliminated the core read_n unsafe block. Only remaining unsafe in reader: read_scalar_array (bulk memcpy for zero-copy arrays).","unsafe_blocks_remaining":"1 (read_scalar_array — genuinely needed for zero-copy)"}}
{"run":35,"commit":"075d42e","metric":11268.25,"metrics":{"decode_ChunkedText_ns":1994.55,"decode_DocumentLarge_ns":2834.57,"decode_DocumentSmall_ns":67.93,"decode_Embedding1536_ns":2.28,"decode_Embedding384_ns":2.29,"decode_Embedding768_ns":2.53,"decode_EmbeddingBatch_ns":555.08,"decode_EmbeddingF32_768_ns":1.69,"decode_EventLarge_ns":13.47,"decode_EventSmall_ns":6.46,"decode_InferenceResponse_ns":66.59,"decode_JsonLarge_ns":1570.52,"decode_JsonSmall_ns":99.41,"decode_LLMChunkLarge_ns":1290.59,"decode_LLMChunkSmall_ns":93.03,"decode_OrderLarge_ns":42.57,"decode_OrderSmall_ns":16.46,"decode_PersonMedium_ns":11.41,"decode_PersonSmall_ns":9.34,"decode_TensorShardLarge_ns":24.25,"decode_TensorShardSmall_ns":26.28,"decode_TreeDeep_ns":1633.34,"decode_TreeWide_ns":903.6},"status":"keep","description":"ABLATION: Downgrade all #[inline(always)] to #[inline] in reader.rs — compiler makes better inlining decisions","timestamp":1774209918220,"segment":0,"confidence":20.254180293887313,"asi":{"hypothesis":"Ablation: test if #[inline(always)] is needed on reader primitives, or if #[inline] gives LLVM enough freedom","finding":"#[inline] is actually slightly BETTER than #[inline(always)] (-1.6%). The forced inlining was causing minor code bloat that hurt icache. With #[inline], LLVM can choose not to inline in cold paths.","simplification":"Replaced 22 #[inline(always)] with #[inline] in reader.rs. Simpler, more idiomatic, and marginally faster.","note":"The original #[inline(always)] was needed when reader was in a separate crate without any inline hint. But #[inline] is sufficient for cross-crate inlining."}}
{"run":36,"commit":"abl_gin","metric":11703.19,"metrics":{"decode_ChunkedText_ns":2003.98,"decode_DocumentLarge_ns":3017.75,"decode_DocumentSmall_ns":70.03,"decode_Embedding1536_ns":1.97,"decode_Embedding384_ns":1.96,"decode_Embedding768_ns":1.93,"decode_EmbeddingBatch_ns":547.85,"decode_EmbeddingF32_768_ns":1.4,"decode_EventLarge_ns":13.87,"decode_EventSmall_ns":9.68,"decode_InferenceResponse_ns":64.85,"decode_JsonLarge_ns":1552.33,"decode_JsonSmall_ns":92.29,"decode_LLMChunkLarge_ns":1347.74,"decode_LLMChunkSmall_ns":96.46,"decode_OrderLarge_ns":46.01,"decode_OrderSmall_ns":19.27,"decode_PersonMedium_ns":12.65,"decode_PersonSmall_ns":10.36,"decode_TensorShardLarge_ns":25.79,"decode_TensorShardSmall_ns":31.3,"decode_TreeDeep_ns":1810.06,"decode_TreeWide_ns":923.66},"status":"discard","description":"ABLATION: Downgrade #[inline(always)] to #[inline] on ALL generated struct+enum decode — regression","timestamp":1774210023735,"segment":0,"confidence":21.647736503950984,"asi":{"hypothesis":"Ablation: test if #[inline(always)] is needed on generated struct/enum decode methods","rollback_reason":"+3.9% regression. EventSmall +50% (enum decode overhead), TreeDeep +10.8%. Generated struct/enum decode methods need forced inlining.","finding":"#[inline(always)] is REQUIRED on generated struct/enum decode. These are called from arrays and nested types where the compiler won't inline without the hint.","next_action_hint":"Try split ablation: keep #[inline(always)] on enums, test downgrade only on structs"}}
{"run":37,"commit":"513f024","metric":11225.46,"metrics":{"decode_ChunkedText_ns":2087.01,"decode_DocumentLarge_ns":2780.47,"decode_DocumentSmall_ns":68.88,"decode_Embedding1536_ns":2.09,"decode_Embedding384_ns":2.68,"decode_Embedding768_ns":2.02,"decode_EmbeddingBatch_ns":529.57,"decode_EmbeddingF32_768_ns":1.53,"decode_EventLarge_ns":16.51,"decode_EventSmall_ns":8.46,"decode_InferenceResponse_ns":64.56,"decode_JsonLarge_ns":1523.78,"decode_JsonSmall_ns":92.22,"decode_LLMChunkLarge_ns":1320.53,"decode_LLMChunkSmall_ns":99.94,"decode_OrderLarge_ns":44.98,"decode_OrderSmall_ns":18.4,"decode_PersonMedium_ns":12.06,"decode_PersonSmall_ns":10.89,"decode_TensorShardLarge_ns":22.08,"decode_TensorShardSmall_ns":29.25,"decode_TreeDeep_ns":1598.79,"decode_TreeWide_ns":888.77},"status":"keep","description":"ABLATION: Downgrade struct decode from #[inline(always)] to #[inline] — only enums need forced inlining","timestamp":1774210088028,"segment":0,"confidence":22.280703966112874,"asi":{"hypothesis":"Ablation: test if struct decode needs #[inline(always)], or if only enum decode needs it","finding":"Struct decode works fine with #[inline]. The previous regression (run 36) was entirely from enum decode. Enums are tiny (1 byte + match) and must be force-inlined. Structs are larger and the compiler makes good decisions with just #[inline].","simplification":"Generator now uses #[inline] for struct decode, #[inline(always)] only for enum decode"}}
{"run":38,"commit":"abl_cap","metric":13026.83,"metrics":{"decode_ChunkedText_ns":2120.13,"decode_DocumentLarge_ns":3135.1,"decode_DocumentSmall_ns":69.93,"decode_Embedding1536_ns":1.96,"decode_Embedding384_ns":2.01,"decode_Embedding768_ns":2.01,"decode_EmbeddingBatch_ns":581.23,"decode_EmbeddingF32_768_ns":1.5,"decode_EventLarge_ns":16.39,"decode_EventSmall_ns":8.82,"decode_InferenceResponse_ns":82.28,"decode_JsonLarge_ns":1530.83,"decode_JsonSmall_ns":100.76,"decode_LLMChunkLarge_ns":2216.98,"decode_LLMChunkSmall_ns":94.96,"decode_OrderLarge_ns":43.53,"decode_OrderSmall_ns":19.21,"decode_PersonMedium_ns":12.83,"decode_PersonSmall_ns":10.79,"decode_TensorShardLarge_ns":38.79,"decode_TensorShardSmall_ns":29.03,"decode_TreeDeep_ns":1750.71,"decode_TreeWide_ns":1157.04},"status":"discard","description":"ABLATION: Remove with_capacity from Vec and HashMap — massive regression confirms it's essential","timestamp":1774210140966,"segment":0,"confidence":21.190992913754073,"asi":{"hypothesis":"Ablation: test if Vec::with_capacity / HashMap::with_capacity matter vs Vec::new()","rollback_reason":"+16% total regression. LLMChunkLarge +68%, TreeWide +30%, TensorShardLarge +77%. Multiple reallocation+copy cycles are expensive.","finding":"with_capacity is ESSENTIAL. Cannot be simplified away. The count-prefixed wire format gives us exact sizes upfront — we must use them.","confirmed_essential":true}}
{"run":39,"commit":"abl_sim","metric":16432.37,"metrics":{"decode_ChunkedText_ns":4514.5,"decode_DocumentLarge_ns":5418.18,"decode_DocumentSmall_ns":67.95,"decode_Embedding1536_ns":1.92,"decode_Embedding384_ns":2.15,"decode_Embedding768_ns":2.14,"decode_EmbeddingBatch_ns":564.1,"decode_EmbeddingF32_768_ns":1.5,"decode_EventLarge_ns":13.97,"decode_EventSmall_ns":8.67,"decode_InferenceResponse_ns":73.8,"decode_JsonLarge_ns":1557.73,"decode_JsonSmall_ns":99.18,"decode_LLMChunkLarge_ns":1297.68,"decode_LLMChunkSmall_ns":95.08,"decode_OrderLarge_ns":44.76,"decode_OrderSmall_ns":18.21,"decode_PersonMedium_ns":9.92,"decode_PersonSmall_ns":9.91,"decode_TensorShardLarge_ns":27.63,"decode_TensorShardSmall_ns":29.32,"decode_TreeDeep_ns":1658.46,"decode_TreeWide_ns":915.59},"status":"discard","description":"ABLATION: Replace simdutf8 with core::str::from_utf8 — massive regression confirms SIMD UTF-8 is essential","timestamp":1774210193630,"segment":0,"confidence":19.81422933763848,"asi":{"hypothesis":"Ablation: test if simdutf8 SIMD acceleration is needed vs core::str::from_utf8","rollback_reason":"+46% total regression. ChunkedText +116%, DocumentLarge +95%. SIMD UTF-8 validation is the single most important optimization.","finding":"simdutf8 is ESSENTIAL and CANNOT be simplified away. It provides 2x+ speedup for large string validation via NEON SIMD.","confirmed_essential":true}}
{"run":40,"commit":"abl_min","metric":11835.83,"metrics":{"decode_ChunkedText_ns":2062.78,"decode_DocumentLarge_ns":2948.03,"decode_DocumentSmall_ns":64.89,"decode_Embedding1536_ns":1.84,"decode_Embedding384_ns":2.02,"decode_Embedding768_ns":2.09,"decode_EmbeddingBatch_ns":568.19,"decode_EmbeddingF32_768_ns":1.5,"decode_EventLarge_ns":15.82,"decode_EventSmall_ns":8.4,"decode_InferenceResponse_ns":65.69,"decode_JsonLarge_ns":1703.32,"decode_JsonSmall_ns":96.7,"decode_LLMChunkLarge_ns":1472.91,"decode_LLMChunkSmall_ns":95.27,"decode_OrderLarge_ns":42.69,"decode_OrderSmall_ns":17.63,"decode_PersonMedium_ns":12.82,"decode_PersonSmall_ns":10.95,"decode_TensorShardLarge_ns":28.62,"decode_TensorShardSmall_ns":65.03,"decode_TreeDeep_ns":1669.33,"decode_TreeWide_ns":879.28},"status":"discard","description":"ABLATION: Remove #[inline] from message/union decode — regression confirms it's needed","timestamp":1774210269524,"segment":0,"confidence":21.190992913754073,"asi":{"hypothesis":"Ablation: test if #[inline] on message/union decode is needed or if compiler inlines cross-crate without the hint","rollback_reason":"+5.4% regression. JsonLarge +12%, LLMChunkLarge +11.5%, TensorShardSmall +124%. Without #[inline], cross-crate message decode is not inlined.","finding":"#[inline] on message/union decode is REQUIRED for cross-crate inlining. Tag loops make these look 'too large' to inline by default.","confirmed_essential":true}}
{"run":41,"commit":"opt_get","metric":11572.42,"metrics":{"decode_ChunkedText_ns":2001.53,"decode_DocumentLarge_ns":2959.97,"decode_DocumentSmall_ns":70.67,"decode_Embedding1536_ns":2.1,"decode_Embedding384_ns":2.22,"decode_Embedding768_ns":1.82,"decode_EmbeddingBatch_ns":547.9,"decode_EmbeddingF32_768_ns":1.4,"decode_EventLarge_ns":14.72,"decode_EventSmall_ns":8.42,"decode_InferenceResponse_ns":61.23,"decode_JsonLarge_ns":1604.14,"decode_JsonSmall_ns":97.94,"decode_LLMChunkLarge_ns":1416.25,"decode_LLMChunkSmall_ns":97,"decode_OrderLarge_ns":46.09,"decode_OrderSmall_ns":18.8,"decode_PersonMedium_ns":12.82,"decode_PersonSmall_ns":12.36,"decode_TensorShardLarge_ns":25.75,"decode_TensorShardSmall_ns":30.75,"decode_TreeDeep_ns":1603.31,"decode_TreeWide_ns":935.24},"status":"discard","description":"Try buf.get() in read_n instead of ensure+safe index — slight regression","timestamp":1774210352739,"segment":0,"confidence":22.280703966112874,"asi":{"hypothesis":"buf.get() might simplify read_n by combining bounds check and slice in one step","rollback_reason":"+3.1% regression. The ensure+index pattern generates slightly better code — LLVM can better optimize the separate check+index pattern.","next_action_hint":"Current code is already clean and fast. Focus on remaining forward optimizations."}}
{"run":42,"commit":"281c271","metric":11230.64,"metrics":{"decode_ChunkedText_ns":1979,"decode_DocumentLarge_ns":2785.7,"decode_DocumentSmall_ns":67.04,"decode_Embedding1536_ns":2.04,"decode_Embedding384_ns":1.98,"decode_Embedding768_ns":2.05,"decode_EmbeddingBatch_ns":517.36,"decode_EmbeddingF32_768_ns":1.51,"decode_EventLarge_ns":14.6,"decode_EventSmall_ns":8.47,"decode_InferenceResponse_ns":60.26,"decode_JsonLarge_ns":1495.96,"decode_JsonSmall_ns":99.91,"decode_LLMChunkLarge_ns":1340.82,"decode_LLMChunkSmall_ns":98.05,"decode_OrderLarge_ns":45.79,"decode_OrderSmall_ns":19.59,"decode_PersonMedium_ns":12.92,"decode_PersonSmall_ns":10.59,"decode_TensorShardLarge_ns":28.12,"decode_TensorShardSmall_ns":29.68,"decode_TreeDeep_ns":1691.01,"decode_TreeWide_ns":918.18},"status":"keep","description":"Simplify ensure(): use wrapping_sub comparison instead of checked_add + pattern match","timestamp":1774210584726,"segment":0,"confidence":22.19062327356741,"asi":{"hypothesis":"Simpler ensure() without checked_add may generate tighter bounds-check code on the hot path","finding":"Two runs: 11114, 11231 (avg 11172). Previous best 11225. Marginal improvement within noise, but code is simpler — wrapping_sub comparison is one instruction vs checked_add+branch.","note":"wrapping_sub is safe because pos <= buf.len() is maintained by all advance methods"}}
{"run":43,"commit":"byte_rn","metric":11880.1,"metrics":{"decode_ChunkedText_ns":1937.56,"decode_DocumentLarge_ns":2744.8,"decode_DocumentSmall_ns":64.28,"decode_Embedding1536_ns":1.84,"decode_Embedding384_ns":1.95,"decode_Embedding768_ns":1.88,"decode_EmbeddingBatch_ns":518.63,"decode_EmbeddingF32_768_ns":1.66,"decode_EventLarge_ns":14.74,"decode_EventSmall_ns":8.15,"decode_InferenceResponse_ns":56.38,"decode_JsonLarge_ns":1524.98,"decode_JsonSmall_ns":99.78,"decode_LLMChunkLarge_ns":1336.5,"decode_LLMChunkSmall_ns":106.74,"decode_OrderLarge_ns":48.35,"decode_OrderSmall_ns":19.69,"decode_PersonMedium_ns":12.84,"decode_PersonSmall_ns":11.3,"decode_TensorShardLarge_ns":26.06,"decode_TensorShardSmall_ns":27.42,"decode_TreeDeep_ns":1823.42,"decode_TreeWide_ns":1491.15},"status":"discard","description":"Replace read_byte/read_bool with read_n::<1>() — regression, hand-written single-byte path is faster","timestamp":1774210628532,"segment":0,"confidence":22.618895259547543,"asi":{"hypothesis":"Unify read_byte/read_bool through read_n::<1>() to simplify code","rollback_reason":"+5.8% total, TreeWide +62%. read_n::<1>() goes through ensure+slice+try_into which is heavier than direct if/index for single bytes. LLVM generates a simpler branch for the hand-written path.","finding":"Single-byte reads need dedicated paths. read_n<N> is optimal for N>=2 but adds overhead for N=1 due to slice creation.","next_action_hint":"Keep the separate read_byte/read_bool implementations"}}
{"run":44,"commit":"fff5099","metric":11140.26,"metrics":{"decode_ChunkedText_ns":1989.01,"decode_DocumentLarge_ns":2862.27,"decode_DocumentSmall_ns":71.25,"decode_Embedding1536_ns":2.12,"decode_Embedding384_ns":1.9,"decode_Embedding768_ns":2.05,"decode_EmbeddingBatch_ns":512.97,"decode_EmbeddingF32_768_ns":1.49,"decode_EventLarge_ns":14.51,"decode_EventSmall_ns":8.3,"decode_InferenceResponse_ns":60.26,"decode_JsonLarge_ns":1539.37,"decode_JsonSmall_ns":94.45,"decode_LLMChunkLarge_ns":1359.26,"decode_LLMChunkSmall_ns":95.76,"decode_OrderLarge_ns":44.98,"decode_OrderSmall_ns":18.83,"decode_PersonMedium_ns":13.46,"decode_PersonSmall_ns":10.66,"decode_TensorShardLarge_ns":24.54,"decode_TensorShardSmall_ns":28.38,"decode_TreeDeep_ns":1601.06,"decode_TreeWide_ns":783.41},"status":"keep","description":"read_array: use ptr::write + set_len instead of push — eliminates per-element capacity check","timestamp":1774210925053,"segment":0,"confidence":22.26340939999252,"asi":{"hypothesis":"Vec::push has a capacity check per element even after with_capacity. Using ptr::write + set_len eliminates this.","finding":"Consistent improvement across 3 runs (avg 11,183 vs 11,231 baseline). TreeWide -13% (100 array decodes, 100 eliminated capacity checks per decode). Proper error cleanup via set_len(i) on Err.","note":"Adds 1 unsafe block but with proper cleanup on error path"}}
{"run":45,"commit":"str_inl","metric":11246.27,"metrics":{"decode_ChunkedText_ns":2018.06,"decode_DocumentLarge_ns":2901.28,"decode_DocumentSmall_ns":72.96,"decode_Embedding1536_ns":1.95,"decode_Embedding384_ns":1.83,"decode_Embedding768_ns":2,"decode_EmbeddingBatch_ns":516.64,"decode_EmbeddingF32_768_ns":1.52,"decode_EventLarge_ns":15.92,"decode_EventSmall_ns":7.97,"decode_InferenceResponse_ns":55.78,"decode_JsonLarge_ns":1514.52,"decode_JsonSmall_ns":100.32,"decode_LLMChunkLarge_ns":1335.06,"decode_LLMChunkSmall_ns":96.79,"decode_OrderLarge_ns":44.62,"decode_OrderSmall_ns":18.93,"decode_PersonMedium_ns":13.12,"decode_PersonSmall_ns":11.16,"decode_TensorShardLarge_ns":24.94,"decode_TensorShardSmall_ns":30.41,"decode_TreeDeep_ns":1695.26,"decode_TreeWide_ns":765.22},"status":"checks_failed","description":"Inline length read in read_str — checks failed on formatting","timestamp":1774210997787,"segment":0,"confidence":20.831562726190242,"asi":{"hypothesis":"Inline the u32 length read in read_str to avoid read_u32 → read_n → ensure chain","rollback_reason":"rustfmt formatting issue, fixing and re-running","next_action_hint":"Fix formatting and retry"}}
{"run":46,"commit":"str_in2","metric":11172.26,"metrics":{"decode_ChunkedText_ns":2014.27,"decode_DocumentLarge_ns":2832.03,"decode_DocumentSmall_ns":70.13,"decode_Embedding1536_ns":1.9,"decode_Embedding384_ns":2.05,"decode_Embedding768_ns":2.09,"decode_EmbeddingBatch_ns":542.56,"decode_EmbeddingF32_768_ns":1.53,"decode_EventLarge_ns":14.9,"decode_EventSmall_ns":8.63,"decode_InferenceResponse_ns":63.11,"decode_JsonLarge_ns":1583,"decode_JsonSmall_ns":109.25,"decode_LLMChunkLarge_ns":1359.87,"decode_LLMChunkSmall_ns":94.96,"decode_OrderLarge_ns":41.33,"decode_OrderSmall_ns":18.77,"decode_PersonMedium_ns":12.75,"decode_PersonSmall_ns":11.4,"decode_TensorShardLarge_ns":24.9,"decode_TensorShardSmall_ns":27.92,"decode_TreeDeep_ns":1569.48,"decode_TreeWide_ns":765.42},"status":"discard","description":"Inline u32 length read in read_str — no improvement, LLVM already inlines the chain","timestamp":1774211047842,"segment":0,"confidence":20.550622487878492,"asi":{"hypothesis":"Inlining the u32 read directly in read_str avoids function call overhead from read_u32 → read_n → ensure chain","rollback_reason":"Within noise (+0.3%). LLVM already inlines the entire chain with #[inline]. Manual inlining adds code complexity for zero benefit.","finding":"read_u32 → read_n → ensure is already fully inlined by LLVM in read_str context"}}
{"run":47,"commit":"map_chk","metric":11078.9,"metrics":{"decode_ChunkedText_ns":1971.6,"decode_DocumentLarge_ns":2836.98,"decode_DocumentSmall_ns":67.52,"decode_Embedding1536_ns":2.03,"decode_Embedding384_ns":1.93,"decode_Embedding768_ns":1.97,"decode_EmbeddingBatch_ns":522.1,"decode_EmbeddingF32_768_ns":1.54,"decode_EventLarge_ns":15.23,"decode_EventSmall_ns":8.14,"decode_InferenceResponse_ns":57.76,"decode_JsonLarge_ns":1522.5,"decode_JsonSmall_ns":93.72,"decode_LLMChunkLarge_ns":1374.32,"decode_LLMChunkSmall_ns":100.43,"decode_OrderLarge_ns":43.83,"decode_OrderSmall_ns":18.81,"decode_PersonMedium_ns":11.71,"decode_PersonSmall_ns":10.68,"decode_TensorShardLarge_ns":29.02,"decode_TensorShardSmall_ns":30.42,"decode_TreeDeep_ns":1603.41,"decode_TreeWide_ns":753.25},"status":"discard","description":"Simplify read_map sanity check (remove /2 division) — no improvement, weakens safety","timestamp":1774211093011,"segment":0,"confidence":18.880036397494518,"asi":{"hypothesis":"Division in read_map sanity check might add overhead","rollback_reason":"Within noise (-0.5%). The /2 division is a one-time cost per map decode. The tighter check is more defensive against corrupt data.","finding":"read_map /2 check has negligible performance impact. Keep the tighter safety check."}}
